2026-01-05 16:26:47,323 - INFO - ============================================================
2026-01-05 16:26:47,323 - INFO - Starting Google Trends fetch job - MASTER FILE MODE
2026-01-05 16:26:47,323 - INFO - Batch size: 75
2026-01-05 16:26:47,323 - INFO - ============================================================
2026-01-05 16:26:47,327 - INFO - Loaded master file with 166 rows and 68 terms
2026-01-05 16:26:47,327 - INFO - Loaded 98 terms from queue
2026-01-05 16:26:47,327 - INFO - Found 67 already processed terms
2026-01-05 16:26:47,328 - INFO - Processing batch of 75 new terms
2026-01-05 16:26:47,390 - INFO - [1/75] Processing: /g/120jfhdm
2026-01-05 16:26:47,852 - INFO - ✓ Successfully fetched data for: /g/120jfhdm
2026-01-05 16:26:47,853 - INFO - Waiting 3.6s before next request...
2026-01-05 16:26:51,456 - INFO - [2/75] Processing: /g/120t97td
2026-01-05 16:26:52,045 - WARNING - No data returned for term: /g/120t97td
2026-01-05 16:26:52,045 - INFO - Waiting 4.8s before next request...
2026-01-05 16:26:56,828 - INFO - [3/75] Processing: /g/11c6t_253c
2026-01-05 16:26:57,427 - WARNING - No data returned for term: /g/11c6t_253c
2026-01-05 16:26:57,427 - INFO - Waiting 5.9s before next request...
2026-01-05 16:27:03,287 - INFO - [4/75] Processing: /g/11g_xxld32
2026-01-05 16:27:03,754 - WARNING - No data returned for term: /g/11g_xxld32
2026-01-05 16:27:03,754 - INFO - Waiting 4.6s before next request...
2026-01-05 16:27:08,380 - INFO - [5/75] Processing: /g/121hdyly
2026-01-05 16:27:08,905 - WARNING - No data returned for term: /g/121hdyly
2026-01-05 16:27:08,905 - INFO - Waiting 3.5s before next request...
2026-01-05 16:27:12,455 - INFO - [6/75] Processing: /g/11g0kd3ygw
2026-01-05 16:27:13,153 - WARNING - No data returned for term: /g/11g0kd3ygw
2026-01-05 16:27:13,153 - INFO - Waiting 5.1s before next request...
2026-01-05 16:27:18,270 - INFO - [7/75] Processing: /m/032pvq
2026-01-05 16:27:18,624 - INFO - ✓ Successfully fetched data for: /m/032pvq
2026-01-05 16:27:18,624 - INFO - Waiting 5.5s before next request...
2026-01-05 16:27:24,164 - INFO - [8/75] Processing: /m/033wy6
2026-01-05 16:27:24,734 - INFO - ✓ Successfully fetched data for: /m/033wy6
2026-01-05 16:27:24,735 - INFO - Waiting 4.1s before next request...
2026-01-05 16:27:28,849 - INFO - [9/75] Processing: /g/11fsrbpz7j
2026-01-05 16:27:29,379 - WARNING - No data returned for term: /g/11fsrbpz7j
2026-01-05 16:27:29,380 - INFO - Waiting 3.6s before next request...
2026-01-05 16:27:32,986 - INFO - [10/75] Processing: /g/11ln3kjm27
2026-01-05 16:27:33,485 - INFO - ✓ Successfully fetched data for: /g/11ln3kjm27
2026-01-05 16:27:33,485 - INFO - Waiting 4.7s before next request...
2026-01-05 16:27:38,223 - INFO - [11/75] Processing: /g/11b651vsw1
2026-01-05 16:27:38,792 - INFO - ✓ Successfully fetched data for: /g/11b651vsw1
2026-01-05 16:27:38,792 - INFO - Waiting 5.9s before next request...
2026-01-05 16:27:44,686 - INFO - [12/75] Processing: /m/0462swg
2026-01-05 16:27:45,219 - WARNING - No data returned for term: /m/0462swg
2026-01-05 16:27:45,219 - INFO - Waiting 5.2s before next request...
2026-01-05 16:27:50,389 - INFO - [13/75] Processing: /m/02887sv
2026-01-05 16:27:50,868 - WARNING - No data returned for term: /m/02887sv
2026-01-05 16:27:50,868 - INFO - Waiting 4.7s before next request...
2026-01-05 16:27:55,602 - INFO - [14/75] Processing: /m/0nfn
2026-01-05 16:27:56,104 - INFO - ✓ Successfully fetched data for: /m/0nfn
2026-01-05 16:27:56,104 - INFO - Waiting 4.6s before next request...
2026-01-05 16:28:00,754 - INFO - [15/75] Processing: /m/02wwvy
2026-01-05 16:28:01,319 - INFO - ✓ Successfully fetched data for: /m/02wwvy
2026-01-05 16:28:01,319 - INFO - Waiting 5.8s before next request...
2026-01-05 16:28:07,113 - INFO - [16/75] Processing: /m/02fq2b
2026-01-05 16:28:07,635 - INFO - ✓ Successfully fetched data for: /m/02fq2b
2026-01-05 16:28:07,635 - INFO - Waiting 4.1s before next request...
2026-01-05 16:28:11,725 - INFO - [17/75] Processing: /m/02jnsq
2026-01-05 16:28:12,228 - INFO - ✓ Successfully fetched data for: /m/02jnsq
2026-01-05 16:28:12,229 - INFO - Waiting 5.2s before next request...
2026-01-05 16:28:17,457 - INFO - [18/75] Processing: /g/11g6qj7lt6
2026-01-05 16:28:17,966 - INFO - ✓ Successfully fetched data for: /g/11g6qj7lt6
2026-01-05 16:28:17,966 - INFO - Waiting 3.9s before next request...
2026-01-05 16:28:21,871 - INFO - [19/75] Processing: /m/085n4
2026-01-05 16:28:22,670 - INFO - ✓ Successfully fetched data for: /m/085n4
2026-01-05 16:28:22,670 - INFO - Waiting 3.3s before next request...
2026-01-05 16:28:26,017 - INFO - [20/75] Processing: /g/12twkjsql
2026-01-05 16:28:26,491 - WARNING - No data returned for term: /g/12twkjsql
2026-01-05 16:28:26,492 - INFO - Waiting 3.7s before next request...
2026-01-05 16:28:30,214 - INFO - [21/75] Processing: /g/11j8qrghwl
2026-01-05 16:28:30,713 - INFO - ✓ Successfully fetched data for: /g/11j8qrghwl
2026-01-05 16:28:30,713 - INFO - Waiting 5.1s before next request...
2026-01-05 16:28:35,792 - INFO - [22/75] Processing: /m/02p2c9s
2026-01-05 16:28:36,369 - INFO - ✓ Successfully fetched data for: /m/02p2c9s
2026-01-05 16:28:36,369 - INFO - Waiting 4.2s before next request...
2026-01-05 16:28:40,570 - INFO - [23/75] Processing: /g/11jg330g0l
2026-01-05 16:28:41,070 - INFO - ✓ Successfully fetched data for: /g/11jg330g0l
2026-01-05 16:28:41,070 - INFO - Waiting 5.2s before next request...
2026-01-05 16:28:46,274 - INFO - [24/75] Processing: /m/02jjns
2026-01-05 16:28:46,757 - INFO - ✓ Successfully fetched data for: /m/02jjns
2026-01-05 16:28:46,758 - INFO - Waiting 5.7s before next request...
2026-01-05 16:28:52,431 - INFO - [25/75] Processing: /m/02w88k
2026-01-05 16:28:53,038 - INFO - ✓ Successfully fetched data for: /m/02w88k
2026-01-05 16:28:53,039 - INFO - Waiting 3.0s before next request...
2026-01-05 16:28:56,088 - INFO - [26/75] Processing: /m/05kp2c
2026-01-05 16:28:56,586 - INFO - ✓ Successfully fetched data for: /m/05kp2c
2026-01-05 16:28:56,587 - INFO - Waiting 5.2s before next request...
2026-01-05 16:29:01,759 - INFO - [27/75] Processing: /m/01y3d8
2026-01-05 16:29:02,273 - INFO - ✓ Successfully fetched data for: /m/01y3d8
2026-01-05 16:29:02,273 - INFO - Waiting 5.8s before next request...
2026-01-05 16:29:08,072 - INFO - [28/75] Processing: /g/121jnq1m
2026-01-05 16:29:08,698 - INFO - ✓ Successfully fetched data for: /g/121jnq1m
2026-01-05 16:29:08,698 - INFO - Waiting 3.8s before next request...
2026-01-05 16:29:12,530 - INFO - [29/75] Processing: /g/120jfhdm
2026-01-05 16:29:12,743 - INFO - ✓ Successfully fetched data for: /g/120jfhdm
2026-01-05 16:29:12,743 - INFO - Waiting 5.4s before next request...
2026-01-05 16:29:18,134 - INFO - [30/75] Processing: /m/0p6bb
2026-01-05 16:29:18,649 - INFO - ✓ Successfully fetched data for: /m/0p6bb
2026-01-05 16:29:18,650 - INFO - Waiting 4.3s before next request...
2026-01-05 16:29:22,950 - INFO - [31/75] Processing: /m/018nf6
2026-01-05 16:29:23,479 - INFO - ✓ Successfully fetched data for: /m/018nf6
2026-01-05 16:29:23,479 - INFO - Waiting 3.7s before next request...
2026-01-05 16:29:27,184 - INFO - [32/75] Processing: /m/09s5j9
2026-01-05 16:29:27,786 - INFO - ✓ Successfully fetched data for: /m/09s5j9
2026-01-05 16:29:27,786 - INFO - Waiting 5.0s before next request...
2026-01-05 16:29:32,769 - INFO - [33/75] Processing: /m/08f4gj
2026-01-05 16:29:33,293 - INFO - ✓ Successfully fetched data for: /m/08f4gj
2026-01-05 16:29:33,294 - INFO - Waiting 4.0s before next request...
2026-01-05 16:29:37,295 - INFO - [34/75] Processing: /m/0bg2p
2026-01-05 16:29:37,850 - INFO - ✓ Successfully fetched data for: /m/0bg2p
2026-01-05 16:29:37,850 - INFO - Waiting 3.2s before next request...
2026-01-05 16:29:41,091 - INFO - [35/75] Processing: /g/11c6tyq7nc
2026-01-05 16:29:41,576 - INFO - ✓ Successfully fetched data for: /g/11c6tyq7nc
2026-01-05 16:29:41,576 - INFO - Waiting 5.2s before next request...
2026-01-05 16:29:46,820 - INFO - [36/75] Processing: /g/11c2688p8j
2026-01-05 16:29:47,333 - INFO - ✓ Successfully fetched data for: /g/11c2688p8j
2026-01-05 16:29:47,333 - INFO - Waiting 3.2s before next request...
2026-01-05 16:29:50,586 - INFO - [37/75] Processing: /m/0ffnx
2026-01-05 16:29:51,110 - INFO - ✓ Successfully fetched data for: /m/0ffnx
2026-01-05 16:29:51,110 - INFO - Waiting 4.6s before next request...
2026-01-05 16:29:55,689 - INFO - [38/75] Processing: /m/02ywd
2026-01-05 16:29:56,283 - INFO - ✓ Successfully fetched data for: /m/02ywd
2026-01-05 16:29:56,283 - INFO - Waiting 3.6s before next request...
2026-01-05 16:29:59,855 - INFO - [39/75] Processing: /g/11dxd44r6v
2026-01-05 16:30:00,382 - INFO - ✓ Successfully fetched data for: /g/11dxd44r6v
2026-01-05 16:30:00,382 - INFO - Waiting 4.4s before next request...
2026-01-05 16:30:04,794 - INFO - [40/75] Processing: /g/11kbll0jmc
2026-01-05 16:30:05,283 - WARNING - No data returned for term: /g/11kbll0jmc
2026-01-05 16:30:05,283 - INFO - Waiting 3.5s before next request...
2026-01-05 16:30:08,767 - INFO - [41/75] Processing: /m/04g3r
2026-01-05 16:30:09,326 - INFO - ✓ Successfully fetched data for: /m/04g3r
2026-01-05 16:30:09,326 - INFO - Waiting 4.5s before next request...
2026-01-05 16:30:13,865 - INFO - [42/75] Processing: /m/06l8d
2026-01-05 16:30:14,521 - INFO - ✓ Successfully fetched data for: /m/06l8d
2026-01-05 16:30:14,521 - INFO - Waiting 4.4s before next request...
2026-01-05 16:30:18,955 - INFO - [43/75] Processing: /m/09j2d
2026-01-05 16:30:19,637 - INFO - ✓ Successfully fetched data for: /m/09j2d
2026-01-05 16:30:19,638 - INFO - Waiting 4.0s before next request...
2026-01-05 16:30:23,619 - INFO - [44/75] Processing: /g/11j317hdsz
2026-01-05 16:30:24,105 - WARNING - No data returned for term: /g/11j317hdsz
2026-01-05 16:30:24,105 - INFO - Waiting 4.0s before next request...
2026-01-05 16:30:28,085 - INFO - [45/75] Processing: /m/0c_jw
2026-01-05 16:30:28,660 - INFO - ✓ Successfully fetched data for: /m/0c_jw
2026-01-05 16:30:28,660 - INFO - Waiting 4.7s before next request...
2026-01-05 16:30:33,385 - INFO - [46/75] Processing: /m/01l0mw
2026-01-05 16:30:40,237 - INFO - ✓ Successfully fetched data for: /m/01l0mw
2026-01-05 16:30:40,237 - INFO - Waiting 5.0s before next request...
2026-01-05 16:30:45,231 - INFO - [47/75] Processing: /m/06b49c
2026-01-05 16:30:45,734 - INFO - ✓ Successfully fetched data for: /m/06b49c
2026-01-05 16:30:45,735 - INFO - Waiting 5.3s before next request...
2026-01-05 16:30:51,028 - INFO - [48/75] Processing: /g/11j8qrq5f4
2026-01-05 16:30:51,529 - INFO - ✓ Successfully fetched data for: /g/11j8qrq5f4
2026-01-05 16:30:51,530 - INFO - Waiting 4.2s before next request...
2026-01-05 16:30:55,756 - INFO - [49/75] Processing: /g/11hdw7wpyv
2026-01-05 16:30:56,216 - WARNING - No data returned for term: /g/11hdw7wpyv
2026-01-05 16:30:56,216 - INFO - Waiting 4.4s before next request...
2026-01-05 16:31:00,612 - INFO - [50/75] Processing: /m/022hpx
2026-01-05 16:31:01,139 - INFO - ✓ Successfully fetched data for: /m/022hpx
2026-01-05 16:31:01,140 - INFO - Waiting 5.0s before next request...
2026-01-05 16:31:06,099 - INFO - [51/75] Processing: /m/03glg
2026-01-05 16:31:06,600 - INFO - ✓ Successfully fetched data for: /m/03glg
2026-01-05 16:31:06,600 - INFO - Waiting 5.4s before next request...
2026-01-05 16:31:12,016 - INFO - [52/75] Processing: /m/0204sn
2026-01-05 16:31:12,602 - INFO - ✓ Successfully fetched data for: /m/0204sn
2026-01-05 16:31:12,602 - INFO - Waiting 5.3s before next request...
2026-01-05 16:31:17,911 - INFO - [53/75] Processing: /g/11s7rbxtb8
2026-01-05 16:31:18,443 - INFO - ✓ Successfully fetched data for: /g/11s7rbxtb8
2026-01-05 16:31:18,443 - INFO - Waiting 3.3s before next request...
2026-01-05 16:31:21,743 - INFO - [54/75] Processing: /g/11g6qjtysh
2026-01-05 16:31:22,262 - INFO - ✓ Successfully fetched data for: /g/11g6qjtysh
2026-01-05 16:31:22,262 - INFO - Waiting 3.8s before next request...
2026-01-05 16:31:26,092 - INFO - [55/75] Processing: /g/11h37v75l4
2026-01-05 16:31:26,583 - INFO - ✓ Successfully fetched data for: /g/11h37v75l4
2026-01-05 16:31:26,584 - INFO - Waiting 5.7s before next request...
2026-01-05 16:31:32,290 - INFO - [56/75] Processing: /g/11c6t_549p
2026-01-05 16:31:32,761 - WARNING - No data returned for term: /g/11c6t_549p
2026-01-05 16:31:32,762 - INFO - Waiting 3.6s before next request...
2026-01-05 16:31:36,335 - INFO - [57/75] Processing: /m/02gsv
2026-01-05 16:31:36,897 - INFO - ✓ Successfully fetched data for: /m/02gsv
2026-01-05 16:31:36,897 - INFO - Waiting 4.7s before next request...
2026-01-05 16:31:41,624 - INFO - [58/75] Processing: /m/0f3yyn
2026-01-05 16:31:42,133 - INFO - ✓ Successfully fetched data for: /m/0f3yyn
2026-01-05 16:31:42,133 - INFO - Waiting 4.0s before next request...
2026-01-05 16:31:46,155 - INFO - [59/75] Processing: /m/079k8t
2026-01-05 16:31:46,649 - INFO - ✓ Successfully fetched data for: /m/079k8t
2026-01-05 16:31:46,649 - INFO - Waiting 5.8s before next request...
2026-01-05 16:31:52,504 - INFO - [60/75] Processing: /m/03ggzf
2026-01-05 16:31:53,172 - INFO - ✓ Successfully fetched data for: /m/03ggzf
2026-01-05 16:31:53,172 - INFO - Waiting 5.8s before next request...
2026-01-05 16:31:58,974 - INFO - [61/75] Processing: /m/01hbs0
2026-01-05 16:31:59,520 - INFO - ✓ Successfully fetched data for: /m/01hbs0
2026-01-05 16:31:59,520 - INFO - Waiting 5.7s before next request...
2026-01-05 16:32:05,220 - INFO - [62/75] Processing: /m/01fss9
2026-01-05 16:32:05,791 - INFO - ✓ Successfully fetched data for: /m/01fss9
2026-01-05 16:32:05,791 - INFO - Waiting 4.9s before next request...
2026-01-05 16:32:10,700 - INFO - [63/75] Processing: /m/018ct4
2026-01-05 16:32:11,315 - INFO - ✓ Successfully fetched data for: /m/018ct4
2026-01-05 16:32:11,315 - INFO - Waiting 3.7s before next request...
2026-01-05 16:32:15,028 - INFO - [64/75] Processing: /m/029hyv
2026-01-05 16:32:15,848 - INFO - ✓ Successfully fetched data for: /m/029hyv
2026-01-05 16:32:15,848 - INFO - Waiting 4.6s before next request...
2026-01-05 16:32:20,471 - INFO - [65/75] Processing: /g/11j317sfyk
2026-01-05 16:32:20,962 - WARNING - No data returned for term: /g/11j317sfyk
2026-01-05 16:32:20,962 - INFO - Waiting 4.2s before next request...
2026-01-05 16:32:25,187 - INFO - [66/75] Processing: /m/02mnx9
2026-01-05 16:32:25,657 - INFO - ✓ Successfully fetched data for: /m/02mnx9
2026-01-05 16:32:25,657 - INFO - Waiting 5.9s before next request...
2026-01-05 16:32:31,528 - INFO - [67/75] Processing: /g/11fsrbrqgk
2026-01-05 16:32:32,021 - WARNING - No data returned for term: /g/11fsrbrqgk
2026-01-05 16:32:32,022 - INFO - Waiting 4.4s before next request...
2026-01-05 16:32:36,389 - INFO - [68/75] Processing: /g/11bz0yd_jf
2026-01-05 16:32:36,959 - INFO - ✓ Successfully fetched data for: /g/11bz0yd_jf
2026-01-05 16:32:36,960 - INFO - Waiting 6.0s before next request...
2026-01-05 16:32:42,932 - INFO - [69/75] Processing: /m/01fp90
2026-01-05 16:32:43,430 - INFO - ✓ Successfully fetched data for: /m/01fp90
2026-01-05 16:32:43,430 - INFO - Waiting 3.6s before next request...
2026-01-05 16:32:47,056 - INFO - [70/75] Processing: /g/1q6h_chms
2026-01-05 16:32:47,625 - INFO - ✓ Successfully fetched data for: /g/1q6h_chms
2026-01-05 16:32:47,625 - INFO - Waiting 4.3s before next request...
2026-01-05 16:32:51,900 - INFO - [71/75] Processing: /m/033gpp
2026-01-05 16:32:52,377 - INFO - ✓ Successfully fetched data for: /m/033gpp
2026-01-05 16:32:52,377 - INFO - Waiting 5.7s before next request...
2026-01-05 16:32:58,074 - INFO - [72/75] Processing: /m/04g_71
2026-01-05 16:32:58,563 - INFO - ✓ Successfully fetched data for: /m/04g_71
2026-01-05 16:32:58,563 - INFO - Waiting 4.6s before next request...
2026-01-05 16:33:03,131 - INFO - [73/75] Processing: /g/11h4f8vzqz
2026-01-05 16:33:03,603 - WARNING - No data returned for term: /g/11h4f8vzqz
2026-01-05 16:33:03,604 - INFO - Waiting 5.7s before next request...
2026-01-05 16:33:09,330 - INFO - [74/75] Processing: /m/035czb
2026-01-05 16:33:09,880 - INFO - ✓ Successfully fetched data for: /m/035czb
2026-01-05 16:33:09,880 - INFO - Waiting 4.4s before next request...
2026-01-05 16:33:14,322 - INFO - [75/75] Processing: /m/04115t2
2026-01-05 16:33:15,127 - INFO - ✓ Successfully fetched data for: /m/04115t2
2026-01-05 16:33:15,256 - INFO - Saved master file with 166 rows and 127 terms
2026-01-05 16:33:15,256 - INFO - 💾 Updated master file with 59 new terms
2026-01-05 16:33:15,259 - INFO - 💾 Created backup: data/trends_results/trends_backup_20260105_163315.csv
2026-01-05 16:33:15,259 - INFO - Updated queue with 39 remaining terms
2026-01-05 16:33:15,259 - INFO - ============================================================
2026-01-05 16:33:15,260 - INFO - Job Summary
2026-01-05 16:33:15,260 - INFO - ✓ Successful: 59
2026-01-05 16:33:15,260 - INFO - ✗ Failed: 16
2026-01-05 16:33:15,260 - INFO - 📊 Total terms in master: 127
2026-01-05 16:33:15,260 - INFO - 📊 Remaining in queue: 39
2026-01-05 16:33:15,260 - INFO - ============================================================
