2026-01-05 08:31:29,841 - INFO - ============================================================
2026-01-05 08:31:29,841 - INFO - Starting Google Trends fetch job - MASTER FILE MODE
2026-01-05 08:31:29,841 - INFO - Batch size: 75
2026-01-05 08:31:29,841 - INFO - ============================================================
2026-01-05 08:31:29,843 - INFO - Loaded master file with 166 rows and 5 terms
2026-01-05 08:31:29,844 - INFO - Loaded 179 terms from queue
2026-01-05 08:31:29,844 - INFO - Found 5 already processed terms
2026-01-05 08:31:29,844 - INFO - Processing batch of 75 new terms
2026-01-05 08:31:30,052 - INFO - [1/75] Processing: /m/02v_8dy
2026-01-05 08:31:30,603 - INFO - ✓ Successfully fetched data for: /m/02v_8dy
2026-01-05 08:31:30,604 - INFO - Waiting 5.4s before next request...
2026-01-05 08:31:35,972 - INFO - [2/75] Processing: /m/09jx2
2026-01-05 08:31:36,334 - INFO - ✓ Successfully fetched data for: /m/09jx2
2026-01-05 08:31:36,335 - INFO - Waiting 4.2s before next request...
2026-01-05 08:31:40,528 - INFO - [3/75] Processing: /m/04n7dpf
2026-01-05 08:31:41,001 - INFO - ✓ Successfully fetched data for: /m/04n7dpf
2026-01-05 08:31:41,002 - INFO - Waiting 4.6s before next request...
2026-01-05 08:31:45,593 - INFO - [4/75] Processing: /m/0g_fl
2026-01-05 08:31:46,001 - INFO - ✓ Successfully fetched data for: /m/0g_fl
2026-01-05 08:31:46,001 - INFO - Waiting 5.2s before next request...
2026-01-05 08:31:51,186 - INFO - [5/75] Processing: /m/01rd35
2026-01-05 08:31:51,561 - INFO - ✓ Successfully fetched data for: /m/01rd35
2026-01-05 08:31:51,561 - INFO - Waiting 4.4s before next request...
2026-01-05 08:31:56,006 - INFO - [6/75] Processing: /m/016ldw
2026-01-05 08:31:56,364 - INFO - ✓ Successfully fetched data for: /m/016ldw
2026-01-05 08:31:56,364 - INFO - Waiting 3.1s before next request...
2026-01-05 08:31:59,423 - INFO - [7/75] Processing: /g/11cks2gbc8
2026-01-05 08:31:59,772 - INFO - ✓ Successfully fetched data for: /g/11cks2gbc8
2026-01-05 08:31:59,772 - INFO - Waiting 3.2s before next request...
2026-01-05 08:32:02,940 - INFO - [8/75] Processing: /m/0cvgr
2026-01-05 08:32:03,312 - INFO - ✓ Successfully fetched data for: /m/0cvgr
2026-01-05 08:32:03,312 - INFO - Waiting 3.3s before next request...
2026-01-05 08:32:06,639 - INFO - [9/75] Processing: /m/06bmj
2026-01-05 08:32:06,981 - INFO - ✓ Successfully fetched data for: /m/06bmj
2026-01-05 08:32:06,981 - INFO - Waiting 5.2s before next request...
2026-01-05 08:32:12,161 - INFO - [10/75] Processing: /m/06lry
2026-01-05 08:32:12,534 - INFO - ✓ Successfully fetched data for: /m/06lry
2026-01-05 08:32:12,534 - INFO - Waiting 3.2s before next request...
2026-01-05 08:32:15,766 - INFO - [11/75] Processing: /m/0hbm6
2026-01-05 08:32:16,120 - INFO - ✓ Successfully fetched data for: /m/0hbm6
2026-01-05 08:32:16,121 - INFO - Waiting 4.8s before next request...
2026-01-05 08:32:20,882 - INFO - [12/75] Processing: /g/120jfhdm
2026-01-05 08:32:21,201 - WARNING - No data returned for term: /g/120jfhdm
2026-01-05 08:32:21,201 - INFO - Waiting 5.9s before next request...
2026-01-05 08:32:27,068 - INFO - [13/75] Processing: /m/0drqp
2026-01-05 08:32:27,434 - INFO - ✓ Successfully fetched data for: /m/0drqp
2026-01-05 08:32:27,434 - INFO - Waiting 5.3s before next request...
2026-01-05 08:32:32,694 - INFO - [14/75] Processing: /m/014dsx
2026-01-05 08:32:33,140 - INFO - ✓ Successfully fetched data for: /m/014dsx
2026-01-05 08:32:33,140 - INFO - Waiting 4.7s before next request...
2026-01-05 08:32:37,850 - INFO - [15/75] Processing: /m/07s_c
2026-01-05 08:32:38,218 - INFO - ✓ Successfully fetched data for: /m/07s_c
2026-01-05 08:32:38,218 - INFO - Waiting 4.7s before next request...
2026-01-05 08:32:42,966 - INFO - [16/75] Processing: /g/11bc57hf91
2026-01-05 08:32:43,340 - INFO - ✓ Successfully fetched data for: /g/11bc57hf91
2026-01-05 08:32:43,340 - INFO - Waiting 5.4s before next request...
2026-01-05 08:32:48,697 - INFO - [17/75] Processing: /m/01tzw5
2026-01-05 08:32:49,069 - INFO - ✓ Successfully fetched data for: /m/01tzw5
2026-01-05 08:32:49,069 - INFO - Waiting 3.5s before next request...
2026-01-05 08:32:52,542 - INFO - [18/75] Processing: /m/018m33
2026-01-05 08:32:52,975 - INFO - ✓ Successfully fetched data for: /m/018m33
2026-01-05 08:32:52,975 - INFO - Waiting 3.7s before next request...
2026-01-05 08:32:56,683 - INFO - [19/75] Processing: /g/120t97td
2026-01-05 08:32:57,025 - WARNING - No data returned for term: /g/120t97td
2026-01-05 08:32:57,026 - INFO - Waiting 4.2s before next request...
2026-01-05 08:33:01,217 - INFO - [20/75] Processing: /g/121g16mn
2026-01-05 08:33:01,556 - INFO - ✓ Successfully fetched data for: /g/121g16mn
2026-01-05 08:33:01,557 - INFO - Waiting 3.3s before next request...
2026-01-05 08:33:04,840 - INFO - [21/75] Processing: /g/1216wtvp
2026-01-05 08:33:05,187 - INFO - ✓ Successfully fetched data for: /g/1216wtvp
2026-01-05 08:33:05,187 - INFO - Waiting 3.6s before next request...
2026-01-05 08:33:08,798 - INFO - [22/75] Processing: /m/088p1q
2026-01-05 08:33:09,156 - INFO - ✓ Successfully fetched data for: /m/088p1q
2026-01-05 08:33:09,156 - INFO - Waiting 4.1s before next request...
2026-01-05 08:33:13,230 - INFO - [23/75] Processing: /g/1236svz8
2026-01-05 08:33:13,608 - INFO - ✓ Successfully fetched data for: /g/1236svz8
2026-01-05 08:33:13,608 - INFO - Waiting 4.8s before next request...
2026-01-05 08:33:18,407 - INFO - [24/75] Processing: /m/0pb8nv_
2026-01-05 08:33:18,760 - INFO - ✓ Successfully fetched data for: /m/0pb8nv_
2026-01-05 08:33:18,760 - INFO - Waiting 5.4s before next request...
2026-01-05 08:33:24,123 - INFO - [25/75] Processing: /m/02r5p3
2026-01-05 08:33:24,483 - INFO - ✓ Successfully fetched data for: /m/02r5p3
2026-01-05 08:33:24,483 - INFO - Waiting 5.1s before next request...
2026-01-05 08:33:29,593 - INFO - [26/75] Processing: /m/05457c
2026-01-05 08:33:29,947 - INFO - ✓ Successfully fetched data for: /m/05457c
2026-01-05 08:33:29,948 - INFO - Waiting 3.3s before next request...
2026-01-05 08:33:33,209 - INFO - [27/75] Processing: /m/0218w7
2026-01-05 08:33:33,569 - INFO - ✓ Successfully fetched data for: /m/0218w7
2026-01-05 08:33:33,569 - INFO - Waiting 3.7s before next request...
2026-01-05 08:33:37,246 - INFO - [28/75] Processing: /g/11w4h00ll9
2026-01-05 08:33:37,604 - INFO - ✓ Successfully fetched data for: /g/11w4h00ll9
2026-01-05 08:33:37,604 - INFO - Waiting 5.7s before next request...
2026-01-05 08:33:43,325 - INFO - [29/75] Processing: /m/06bmj
2026-01-05 08:33:43,573 - INFO - ✓ Successfully fetched data for: /m/06bmj
2026-01-05 08:33:43,573 - INFO - Waiting 3.9s before next request...
2026-01-05 08:33:47,521 - INFO - [30/75] Processing: /m/026gdg4
2026-01-05 08:33:47,877 - INFO - ✓ Successfully fetched data for: /m/026gdg4
2026-01-05 08:33:47,878 - INFO - Waiting 4.7s before next request...
2026-01-05 08:33:52,600 - INFO - [31/75] Processing: /m/09y23_
2026-01-05 08:33:52,944 - INFO - ✓ Successfully fetched data for: /m/09y23_
2026-01-05 08:33:52,945 - INFO - Waiting 4.3s before next request...
2026-01-05 08:33:57,293 - INFO - [32/75] Processing: /g/11c6t_253c
2026-01-05 08:33:57,602 - WARNING - No data returned for term: /g/11c6t_253c
2026-01-05 08:33:57,602 - INFO - Waiting 5.8s before next request...
2026-01-05 08:34:03,385 - INFO - [33/75] Processing: /m/01s_5
2026-01-05 08:34:03,799 - INFO - ✓ Successfully fetched data for: /m/01s_5
2026-01-05 08:34:03,799 - INFO - Waiting 4.4s before next request...
2026-01-05 08:34:08,242 - INFO - [34/75] Processing: /m/01cf44
2026-01-05 08:34:08,599 - INFO - ✓ Successfully fetched data for: /m/01cf44
2026-01-05 08:34:08,599 - INFO - Waiting 4.2s before next request...
2026-01-05 08:34:12,811 - INFO - [35/75] Processing: /m/0545k
2026-01-05 08:34:13,162 - INFO - ✓ Successfully fetched data for: /m/0545k
2026-01-05 08:34:13,162 - INFO - Waiting 5.5s before next request...
2026-01-05 08:34:18,681 - INFO - [36/75] Processing: /m/01cf0p
2026-01-05 08:34:19,044 - INFO - ✓ Successfully fetched data for: /m/01cf0p
2026-01-05 08:34:19,044 - INFO - Waiting 3.7s before next request...
2026-01-05 08:34:22,788 - INFO - [37/75] Processing: /m/0cs24
2026-01-05 08:34:23,138 - INFO - ✓ Successfully fetched data for: /m/0cs24
2026-01-05 08:34:23,138 - INFO - Waiting 4.2s before next request...
2026-01-05 08:34:27,390 - INFO - [38/75] Processing: /g/11g_xxld32
2026-01-05 08:34:27,726 - WARNING - No data returned for term: /g/11g_xxld32
2026-01-05 08:34:27,727 - INFO - Waiting 5.8s before next request...
2026-01-05 08:34:33,530 - INFO - [39/75] Processing: /m/0z_xz
2026-01-05 08:34:33,895 - INFO - ✓ Successfully fetched data for: /m/0z_xz
2026-01-05 08:34:33,895 - INFO - Waiting 5.7s before next request...
2026-01-05 08:34:39,598 - INFO - [40/75] Processing: /m/0d130
2026-01-05 08:34:39,956 - INFO - ✓ Successfully fetched data for: /m/0d130
2026-01-05 08:34:39,956 - INFO - Waiting 3.0s before next request...
2026-01-05 08:34:42,974 - INFO - [41/75] Processing: /m/0hdyy
2026-01-05 08:34:43,320 - INFO - ✓ Successfully fetched data for: /m/0hdyy
2026-01-05 08:34:43,320 - INFO - Waiting 5.4s before next request...
2026-01-05 08:34:48,702 - INFO - [42/75] Processing: /m/011d_9rh
2026-01-05 08:34:49,071 - INFO - ✓ Successfully fetched data for: /m/011d_9rh
2026-01-05 08:34:49,071 - INFO - Waiting 5.4s before next request...
2026-01-05 08:34:54,525 - INFO - [43/75] Processing: /m/04sng5
2026-01-05 08:34:54,867 - INFO - ✓ Successfully fetched data for: /m/04sng5
2026-01-05 08:34:54,867 - INFO - Waiting 6.0s before next request...
2026-01-05 08:35:00,827 - INFO - [44/75] Processing: /m/0hhw8xd
2026-01-05 08:35:01,186 - INFO - ✓ Successfully fetched data for: /m/0hhw8xd
2026-01-05 08:35:01,186 - INFO - Waiting 3.8s before next request...
2026-01-05 08:35:05,029 - INFO - [45/75] Processing: /m/05nxj0
2026-01-05 08:35:05,397 - INFO - ✓ Successfully fetched data for: /m/05nxj0
2026-01-05 08:35:05,397 - INFO - Waiting 4.8s before next request...
2026-01-05 08:35:10,229 - INFO - [46/75] Processing: /g/121hdyly
2026-01-05 08:35:10,553 - WARNING - No data returned for term: /g/121hdyly
2026-01-05 08:35:10,553 - INFO - Waiting 3.5s before next request...
2026-01-05 08:35:14,026 - INFO - [47/75] Processing: /m/0c40cq0
2026-01-05 08:35:14,385 - INFO - ✓ Successfully fetched data for: /m/0c40cq0
2026-01-05 08:35:14,386 - INFO - Waiting 5.5s before next request...
2026-01-05 08:35:19,935 - INFO - [48/75] Processing: /g/11g0kd3ygw
2026-01-05 08:35:20,264 - WARNING - No data returned for term: /g/11g0kd3ygw
2026-01-05 08:35:20,264 - INFO - Waiting 4.6s before next request...
2026-01-05 08:35:24,820 - INFO - [49/75] Processing: /m/032pvq
2026-01-05 08:35:25,167 - WARNING - No data returned for term: /m/032pvq
2026-01-05 08:35:25,168 - INFO - Waiting 3.5s before next request...
2026-01-05 08:35:28,687 - INFO - [50/75] Processing: /m/06njd
2026-01-05 08:35:29,045 - INFO - ✓ Successfully fetched data for: /m/06njd
2026-01-05 08:35:29,045 - INFO - Waiting 3.5s before next request...
2026-01-05 08:35:32,538 - INFO - [51/75] Processing: /m/033wy6
2026-01-05 08:35:32,874 - WARNING - No data returned for term: /m/033wy6
2026-01-05 08:35:32,874 - INFO - Waiting 4.0s before next request...
2026-01-05 08:35:36,913 - INFO - [52/75] Processing: /m/081zw_
2026-01-05 08:35:37,258 - INFO - ✓ Successfully fetched data for: /m/081zw_
2026-01-05 08:35:37,258 - INFO - Waiting 5.8s before next request...
2026-01-05 08:35:43,086 - INFO - [53/75] Processing: /m/02vtq7g
2026-01-05 08:35:43,452 - INFO - ✓ Successfully fetched data for: /m/02vtq7g
2026-01-05 08:35:43,452 - INFO - Waiting 6.0s before next request...
2026-01-05 08:35:49,416 - INFO - [54/75] Processing: /m/091tvr
2026-01-05 08:35:49,766 - INFO - ✓ Successfully fetched data for: /m/091tvr
2026-01-05 08:35:49,767 - INFO - Waiting 3.3s before next request...
2026-01-05 08:35:53,064 - INFO - [55/75] Processing: /m/02r49f
2026-01-05 08:35:53,430 - INFO - ✓ Successfully fetched data for: /m/02r49f
2026-01-05 08:35:53,431 - INFO - Waiting 3.5s before next request...
2026-01-05 08:35:56,886 - INFO - [56/75] Processing: /m/01406c
2026-01-05 08:35:57,276 - INFO - ✓ Successfully fetched data for: /m/01406c
2026-01-05 08:35:57,276 - INFO - Waiting 3.9s before next request...
2026-01-05 08:36:01,189 - INFO - [57/75] Processing: /m/04f0h
2026-01-05 08:36:01,550 - INFO - ✓ Successfully fetched data for: /m/04f0h
2026-01-05 08:36:01,551 - INFO - Waiting 5.2s before next request...
2026-01-05 08:36:06,800 - INFO - [58/75] Processing: /m/020d7_
2026-01-05 08:36:07,147 - INFO - ✓ Successfully fetched data for: /m/020d7_
2026-01-05 08:36:07,147 - INFO - Waiting 3.7s before next request...
2026-01-05 08:36:10,834 - INFO - [59/75] Processing: /g/1213tqm6
2026-01-05 08:36:11,188 - INFO - ✓ Successfully fetched data for: /g/1213tqm6
2026-01-05 08:36:11,189 - INFO - Waiting 3.5s before next request...
2026-01-05 08:36:14,666 - INFO - [60/75] Processing: /m/0h7q5bz
2026-01-05 08:36:15,024 - INFO - ✓ Successfully fetched data for: /m/0h7q5bz
2026-01-05 08:36:15,024 - INFO - Waiting 5.0s before next request...
2026-01-05 08:36:20,010 - INFO - [61/75] Processing: /g/11fsrbpz7j
2026-01-05 08:36:20,464 - WARNING - No data returned for term: /g/11fsrbpz7j
2026-01-05 08:36:20,464 - INFO - Waiting 4.7s before next request...
2026-01-05 08:36:25,120 - INFO - [62/75] Processing: /m/025t20m
2026-01-05 08:36:25,476 - INFO - ✓ Successfully fetched data for: /m/025t20m
2026-01-05 08:36:25,476 - INFO - Waiting 5.5s before next request...
2026-01-05 08:36:30,995 - INFO - [63/75] Processing: /m/042px7
2026-01-05 08:36:31,579 - INFO - ✓ Successfully fetched data for: /m/042px7
2026-01-05 08:36:31,579 - INFO - Waiting 3.9s before next request...
2026-01-05 08:36:35,503 - INFO - [64/75] Processing: /m/017l39
2026-01-05 08:36:36,048 - INFO - ✓ Successfully fetched data for: /m/017l39
2026-01-05 08:36:36,049 - INFO - Waiting 5.5s before next request...
2026-01-05 08:36:41,550 - INFO - [65/75] Processing: /g/11cp7w3r6w
2026-01-05 08:36:41,900 - INFO - ✓ Successfully fetched data for: /g/11cp7w3r6w
2026-01-05 08:36:41,900 - INFO - Waiting 4.7s before next request...
2026-01-05 08:36:46,571 - INFO - [66/75] Processing: /g/11ln3kjm27
2026-01-05 08:36:46,893 - WARNING - No data returned for term: /g/11ln3kjm27
2026-01-05 08:36:46,893 - INFO - Waiting 4.2s before next request...
2026-01-05 08:36:51,056 - INFO - [67/75] Processing: /g/11fsrblbyd
2026-01-05 08:36:51,424 - INFO - ✓ Successfully fetched data for: /g/11fsrblbyd
2026-01-05 08:36:51,424 - INFO - Waiting 4.5s before next request...
2026-01-05 08:36:55,968 - INFO - [68/75] Processing: /m/03nw7w
2026-01-05 08:36:56,333 - INFO - ✓ Successfully fetched data for: /m/03nw7w
2026-01-05 08:36:56,334 - INFO - Waiting 5.7s before next request...
2026-01-05 08:37:02,062 - INFO - [69/75] Processing: /g/11lc9ltvgb
2026-01-05 08:37:02,419 - INFO - ✓ Successfully fetched data for: /g/11lc9ltvgb
2026-01-05 08:37:02,419 - INFO - Waiting 4.9s before next request...
2026-01-05 08:37:07,347 - INFO - [70/75] Processing: /g/11s7rb01fr
2026-01-05 08:37:07,687 - INFO - ✓ Successfully fetched data for: /g/11s7rb01fr
2026-01-05 08:37:07,687 - INFO - Waiting 5.6s before next request...
2026-01-05 08:37:13,262 - INFO - [71/75] Processing: /g/11b651vsw1
2026-01-05 08:37:13,582 - WARNING - No data returned for term: /g/11b651vsw1
2026-01-05 08:37:13,583 - INFO - Waiting 4.7s before next request...
2026-01-05 08:37:18,337 - INFO - [72/75] Processing: /g/120lq987
2026-01-05 08:37:18,686 - INFO - ✓ Successfully fetched data for: /g/120lq987
2026-01-05 08:37:18,686 - INFO - Waiting 4.8s before next request...
2026-01-05 08:37:23,507 - INFO - [73/75] Processing: /m/079gm
2026-01-05 08:37:23,858 - INFO - ✓ Successfully fetched data for: /m/079gm
2026-01-05 08:37:23,858 - INFO - Waiting 5.6s before next request...
2026-01-05 08:37:29,467 - INFO - [74/75] Processing: /g/1q582vwlz
2026-01-05 08:37:29,809 - INFO - ✓ Successfully fetched data for: /g/1q582vwlz
2026-01-05 08:37:29,809 - INFO - Waiting 5.2s before next request...
2026-01-05 08:37:35,044 - INFO - [75/75] Processing: /m/0462swg
2026-01-05 08:37:35,362 - WARNING - No data returned for term: /m/0462swg
2026-01-05 08:37:35,496 - INFO - Saved master file with 166 rows and 68 terms
2026-01-05 08:37:35,496 - INFO - 💾 Updated master file with 63 new terms
2026-01-05 08:37:35,498 - INFO - 💾 Created backup: data/trends_results/trends_backup_20260105_083735.csv
2026-01-05 08:37:35,499 - INFO - Updated queue with 98 remaining terms
2026-01-05 08:37:35,499 - INFO - ============================================================
2026-01-05 08:37:35,499 - INFO - Job Summary
2026-01-05 08:37:35,499 - INFO - ✓ Successful: 63
2026-01-05 08:37:35,499 - INFO - ✗ Failed: 12
2026-01-05 08:37:35,499 - INFO - 📊 Total terms in master: 68
2026-01-05 08:37:35,499 - INFO - 📊 Remaining in queue: 98
2026-01-05 08:37:35,499 - INFO - ============================================================
