2026-01-05 04:02:54,564 - INFO - ============================================================
2026-01-05 04:02:54,564 - INFO - Starting Multi-Country Google Trends Fetch Job
2026-01-05 04:02:54,564 - INFO - Batch size per country: 75
2026-01-05 04:02:54,565 - INFO - ============================================================
2026-01-05 04:02:54,565 - INFO - Loaded 41 countries
2026-01-05 04:02:54,565 - INFO - Loaded 5 terms from queue
2026-01-05 04:02:54,784 - INFO - ============================================================
2026-01-05 04:02:54,785 - INFO - Processing country: DK (DK)
2026-01-05 04:02:54,785 - INFO - ============================================================
2026-01-05 04:02:54,788 - INFO - Loaded master file for DK with 166 rows and 39 terms
2026-01-05 04:02:54,788 - INFO - Processing batch of 5 terms for DK
2026-01-05 04:02:54,788 - INFO - Remaining terms after this batch: 0
2026-01-05 04:02:54,788 - INFO - [1/5] DK - Processing: /m/01q82
2026-01-05 04:02:56,685 - INFO - ✓ Successfully fetched data for: /m/01q82 (DK)
2026-01-05 04:02:56,685 - INFO - Waiting 4.3s before next request...
2026-01-05 04:03:01,024 - INFO - [2/5] DK - Processing: /g/1211cg58
2026-01-05 04:03:01,674 - INFO - ✓ Successfully fetched data for: /g/1211cg58 (DK)
2026-01-05 04:03:01,674 - INFO - Waiting 5.6s before next request...
2026-01-05 04:03:07,285 - INFO - [3/5] DK - Processing: /m/012_3l
2026-01-05 04:03:07,946 - INFO - ✓ Successfully fetched data for: /m/012_3l (DK)
2026-01-05 04:03:07,946 - INFO - Waiting 3.3s before next request...
2026-01-05 04:03:11,262 - INFO - [4/5] DK - Processing: /m/0gfps3
2026-01-05 04:03:12,629 - INFO - ✓ Successfully fetched data for: /m/0gfps3 (DK)
2026-01-05 04:03:12,629 - INFO - Waiting 5.0s before next request...
2026-01-05 04:03:17,590 - INFO - [5/5] DK - Processing: /g/11gbfbpzht
2026-01-05 04:03:18,114 - INFO - ✓ Successfully fetched data for: /g/11gbfbpzht (DK)
2026-01-05 04:03:18,124 - INFO - Saved master file for DK with 166 rows and 44 terms
2026-01-05 04:03:18,124 - INFO - 💾 Updated master file for DK with 5 new terms
2026-01-05 04:03:18,126 - INFO - 💾 Created backup: data/trends_results/trends_backup_DK_20260105_040318.csv
2026-01-05 04:03:18,126 - INFO - Waiting 8.3s before next country...
2026-01-05 04:03:26,414 - INFO - ============================================================
2026-01-05 04:03:26,414 - INFO - Processing country: AU (AU)
2026-01-05 04:03:26,414 - INFO - ============================================================
2026-01-05 04:03:26,417 - INFO - Loaded master file for AU with 166 rows and 39 terms
2026-01-05 04:03:26,417 - INFO - Processing batch of 5 terms for AU
2026-01-05 04:03:26,418 - INFO - Remaining terms after this batch: 0
2026-01-05 04:03:26,418 - INFO - [1/5] AU - Processing: /m/01q82
2026-01-05 04:03:26,797 - INFO - ✓ Successfully fetched data for: /m/01q82 (AU)
2026-01-05 04:03:26,797 - INFO - Waiting 4.9s before next request...
2026-01-05 04:03:31,685 - INFO - [2/5] AU - Processing: /g/1211cg58
2026-01-05 04:03:32,220 - INFO - ✓ Successfully fetched data for: /g/1211cg58 (AU)
2026-01-05 04:03:32,221 - INFO - Waiting 3.7s before next request...
2026-01-05 04:03:35,941 - INFO - [3/5] AU - Processing: /m/012_3l
2026-01-05 04:03:36,317 - INFO - ✓ Successfully fetched data for: /m/012_3l (AU)
2026-01-05 04:03:36,317 - INFO - Waiting 4.4s before next request...
2026-01-05 04:03:40,721 - INFO - [4/5] AU - Processing: /m/0gfps3
2026-01-05 04:03:41,242 - INFO - ✓ Successfully fetched data for: /m/0gfps3 (AU)
2026-01-05 04:03:41,242 - INFO - Waiting 3.8s before next request...
2026-01-05 04:03:45,050 - INFO - [5/5] AU - Processing: /g/11gbfbpzht
2026-01-05 04:03:45,636 - INFO - ✓ Successfully fetched data for: /g/11gbfbpzht (AU)
2026-01-05 04:03:45,646 - INFO - Saved master file for AU with 166 rows and 44 terms
2026-01-05 04:03:45,647 - INFO - 💾 Updated master file for AU with 5 new terms
2026-01-05 04:03:45,648 - INFO - 💾 Created backup: data/trends_results/trends_backup_AU_20260105_040345.csv
2026-01-05 04:03:45,648 - INFO - Waiting 10.3s before next country...
2026-01-05 04:03:55,958 - INFO - ============================================================
2026-01-05 04:03:55,958 - INFO - Processing country: CL (CL)
2026-01-05 04:03:55,958 - INFO - ============================================================
2026-01-05 04:03:55,961 - INFO - Loaded master file for CL with 166 rows and 39 terms
2026-01-05 04:03:55,961 - INFO - Processing batch of 5 terms for CL
2026-01-05 04:03:55,961 - INFO - Remaining terms after this batch: 0
2026-01-05 04:03:55,961 - INFO - [1/5] CL - Processing: /m/01q82
2026-01-05 04:03:56,375 - INFO - ✓ Successfully fetched data for: /m/01q82 (CL)
2026-01-05 04:03:56,375 - INFO - Waiting 5.3s before next request...
2026-01-05 04:04:01,673 - INFO - [2/5] CL - Processing: /g/1211cg58
2026-01-05 04:04:02,018 - INFO - ✓ Successfully fetched data for: /g/1211cg58 (CL)
2026-01-05 04:04:02,018 - INFO - Waiting 5.0s before next request...
2026-01-05 04:04:07,022 - INFO - [3/5] CL - Processing: /m/012_3l
2026-01-05 04:04:07,388 - INFO - ✓ Successfully fetched data for: /m/012_3l (CL)
2026-01-05 04:04:07,388 - INFO - Waiting 4.3s before next request...
2026-01-05 04:04:11,679 - INFO - [4/5] CL - Processing: /m/0gfps3
2026-01-05 04:04:12,167 - INFO - ✓ Successfully fetched data for: /m/0gfps3 (CL)
2026-01-05 04:04:12,167 - INFO - Waiting 3.5s before next request...
2026-01-05 04:04:15,675 - INFO - [5/5] CL - Processing: /g/11gbfbpzht
2026-01-05 04:04:16,201 - INFO - ✓ Successfully fetched data for: /g/11gbfbpzht (CL)
2026-01-05 04:04:16,211 - INFO - Saved master file for CL with 166 rows and 44 terms
2026-01-05 04:04:16,211 - INFO - 💾 Updated master file for CL with 5 new terms
2026-01-05 04:04:16,212 - INFO - 💾 Created backup: data/trends_results/trends_backup_CL_20260105_040416.csv
2026-01-05 04:04:16,213 - INFO - Waiting 10.8s before next country...
2026-01-05 04:04:26,992 - INFO - ============================================================
2026-01-05 04:04:26,993 - INFO - Processing country: CO (CO)
2026-01-05 04:04:26,993 - INFO - ============================================================
2026-01-05 04:04:26,995 - INFO - Loaded master file for CO with 166 rows and 39 terms
2026-01-05 04:04:26,996 - INFO - Processing batch of 5 terms for CO
2026-01-05 04:04:26,996 - INFO - Remaining terms after this batch: 0
2026-01-05 04:04:26,996 - INFO - [1/5] CO - Processing: /m/01q82
2026-01-05 04:04:27,362 - INFO - ✓ Successfully fetched data for: /m/01q82 (CO)
2026-01-05 04:04:27,362 - INFO - Waiting 5.5s before next request...
2026-01-05 04:04:32,853 - INFO - [2/5] CO - Processing: /g/1211cg58
2026-01-05 04:04:33,217 - INFO - ✓ Successfully fetched data for: /g/1211cg58 (CO)
2026-01-05 04:04:33,217 - INFO - Waiting 5.7s before next request...
2026-01-05 04:04:38,941 - INFO - [3/5] CO - Processing: /m/012_3l
2026-01-05 04:04:39,291 - INFO - ✓ Successfully fetched data for: /m/012_3l (CO)
2026-01-05 04:04:39,291 - INFO - Waiting 3.3s before next request...
2026-01-05 04:04:42,622 - INFO - [4/5] CO - Processing: /m/0gfps3
2026-01-05 04:04:43,206 - INFO - ✓ Successfully fetched data for: /m/0gfps3 (CO)
2026-01-05 04:04:43,206 - INFO - Waiting 5.6s before next request...
2026-01-05 04:04:48,774 - INFO - [5/5] CO - Processing: /g/11gbfbpzht
2026-01-05 04:04:49,349 - INFO - ✓ Successfully fetched data for: /g/11gbfbpzht (CO)
2026-01-05 04:04:49,358 - INFO - Saved master file for CO with 166 rows and 44 terms
2026-01-05 04:04:49,359 - INFO - 💾 Updated master file for CO with 5 new terms
2026-01-05 04:04:49,360 - INFO - 💾 Created backup: data/trends_results/trends_backup_CO_20260105_040449.csv
2026-01-05 04:04:49,360 - INFO - Waiting 8.9s before next country...
2026-01-05 04:04:58,273 - INFO - ============================================================
2026-01-05 04:04:58,273 - INFO - Processing country: EE (EE)
2026-01-05 04:04:58,273 - INFO - ============================================================
2026-01-05 04:04:58,276 - INFO - Loaded master file for EE with 166 rows and 39 terms
2026-01-05 04:04:58,276 - INFO - Processing batch of 5 terms for EE
2026-01-05 04:04:58,276 - INFO - Remaining terms after this batch: 0
2026-01-05 04:04:58,276 - INFO - [1/5] EE - Processing: /m/01q82
2026-01-05 04:04:58,621 - INFO - ✓ Successfully fetched data for: /m/01q82 (EE)
2026-01-05 04:04:58,621 - INFO - Waiting 5.7s before next request...
2026-01-05 04:05:04,280 - INFO - [2/5] EE - Processing: /g/1211cg58
2026-01-05 04:05:04,645 - INFO - ✓ Successfully fetched data for: /g/1211cg58 (EE)
2026-01-05 04:05:04,645 - INFO - Waiting 3.9s before next request...
2026-01-05 04:05:08,554 - INFO - [3/5] EE - Processing: /m/012_3l
2026-01-05 04:05:08,916 - INFO - ✓ Successfully fetched data for: /m/012_3l (EE)
2026-01-05 04:05:08,916 - INFO - Waiting 5.3s before next request...
2026-01-05 04:05:14,194 - INFO - [4/5] EE - Processing: /m/0gfps3
2026-01-05 04:05:14,559 - INFO - ✓ Successfully fetched data for: /m/0gfps3 (EE)
2026-01-05 04:05:14,560 - INFO - Waiting 3.9s before next request...
2026-01-05 04:05:18,497 - INFO - [5/5] EE - Processing: /g/11gbfbpzht
2026-01-05 04:05:18,845 - INFO - ✓ Successfully fetched data for: /g/11gbfbpzht (EE)
2026-01-05 04:05:18,855 - INFO - Saved master file for EE with 166 rows and 44 terms
2026-01-05 04:05:18,855 - INFO - 💾 Updated master file for EE with 5 new terms
2026-01-05 04:05:18,857 - INFO - 💾 Created backup: data/trends_results/trends_backup_EE_20260105_040518.csv
2026-01-05 04:05:18,857 - INFO - Waiting 7.5s before next country...
2026-01-05 04:05:26,326 - INFO - ============================================================
2026-01-05 04:05:26,326 - INFO - Processing country: FI (FI)
2026-01-05 04:05:26,326 - INFO - ============================================================
2026-01-05 04:05:26,329 - INFO - Loaded master file for FI with 166 rows and 39 terms
2026-01-05 04:05:26,329 - INFO - Processing batch of 5 terms for FI
2026-01-05 04:05:26,329 - INFO - Remaining terms after this batch: 0
2026-01-05 04:05:26,329 - INFO - [1/5] FI - Processing: /m/01q82
2026-01-05 04:05:27,173 - INFO - ✓ Successfully fetched data for: /m/01q82 (FI)
2026-01-05 04:05:27,174 - INFO - Waiting 4.3s before next request...
2026-01-05 04:05:31,466 - INFO - [2/5] FI - Processing: /g/1211cg58
2026-01-05 04:05:31,929 - INFO - ✓ Successfully fetched data for: /g/1211cg58 (FI)
2026-01-05 04:05:31,929 - INFO - Waiting 6.0s before next request...
2026-01-05 04:05:37,906 - INFO - [3/5] FI - Processing: /m/012_3l
2026-01-05 04:05:38,520 - INFO - ✓ Successfully fetched data for: /m/012_3l (FI)
2026-01-05 04:05:38,520 - INFO - Waiting 4.7s before next request...
2026-01-05 04:05:43,250 - INFO - [4/5] FI - Processing: /m/0gfps3
2026-01-05 04:05:43,913 - INFO - ✓ Successfully fetched data for: /m/0gfps3 (FI)
2026-01-05 04:05:43,913 - INFO - Waiting 3.3s before next request...
2026-01-05 04:05:47,213 - INFO - [5/5] FI - Processing: /g/11gbfbpzht
2026-01-05 04:05:47,607 - INFO - ✓ Successfully fetched data for: /g/11gbfbpzht (FI)
2026-01-05 04:05:47,617 - INFO - Saved master file for FI with 166 rows and 44 terms
2026-01-05 04:05:47,617 - INFO - 💾 Updated master file for FI with 5 new terms
2026-01-05 04:05:47,619 - INFO - 💾 Created backup: data/trends_results/trends_backup_FI_20260105_040547.csv
2026-01-05 04:05:47,619 - INFO - Waiting 6.0s before next country...
2026-01-05 04:05:53,669 - INFO - ============================================================
2026-01-05 04:05:53,669 - INFO - Processing country: FR (FR)
2026-01-05 04:05:53,669 - INFO - ============================================================
2026-01-05 04:05:53,672 - INFO - Loaded master file for FR with 166 rows and 39 terms
2026-01-05 04:05:53,672 - INFO - Processing batch of 5 terms for FR
2026-01-05 04:05:53,672 - INFO - Remaining terms after this batch: 0
2026-01-05 04:05:53,672 - INFO - [1/5] FR - Processing: /m/01q82
2026-01-05 04:05:54,053 - INFO - ✓ Successfully fetched data for: /m/01q82 (FR)
2026-01-05 04:05:54,053 - INFO - Waiting 3.9s before next request...
2026-01-05 04:05:58,003 - INFO - [2/5] FR - Processing: /g/1211cg58
2026-01-05 04:05:58,644 - INFO - ✓ Successfully fetched data for: /g/1211cg58 (FR)
2026-01-05 04:05:58,644 - INFO - Waiting 5.8s before next request...
2026-01-05 04:06:04,466 - INFO - [3/5] FR - Processing: /m/012_3l
2026-01-05 04:06:05,192 - INFO - ✓ Successfully fetched data for: /m/012_3l (FR)
2026-01-05 04:06:05,192 - INFO - Waiting 3.7s before next request...
2026-01-05 04:06:08,902 - INFO - [4/5] FR - Processing: /m/0gfps3
2026-01-05 04:06:09,515 - INFO - ✓ Successfully fetched data for: /m/0gfps3 (FR)
2026-01-05 04:06:09,515 - INFO - Waiting 3.8s before next request...
2026-01-05 04:06:13,325 - INFO - [5/5] FR - Processing: /g/11gbfbpzht
2026-01-05 04:06:14,111 - INFO - ✓ Successfully fetched data for: /g/11gbfbpzht (FR)
2026-01-05 04:06:14,121 - INFO - Saved master file for FR with 166 rows and 44 terms
2026-01-05 04:06:14,121 - INFO - 💾 Updated master file for FR with 5 new terms
2026-01-05 04:06:14,123 - INFO - 💾 Created backup: data/trends_results/trends_backup_FR_20260105_040614.csv
2026-01-05 04:06:14,123 - INFO - Waiting 7.6s before next country...
2026-01-05 04:06:21,737 - INFO - ============================================================
2026-01-05 04:06:21,737 - INFO - Processing country: DE (DE)
2026-01-05 04:06:21,737 - INFO - ============================================================
2026-01-05 04:06:21,740 - INFO - Loaded master file for DE with 166 rows and 39 terms
2026-01-05 04:06:21,740 - INFO - Processing batch of 5 terms for DE
2026-01-05 04:06:21,740 - INFO - Remaining terms after this batch: 0
2026-01-05 04:06:21,740 - INFO - [1/5] DE - Processing: /m/01q82
2026-01-05 04:06:22,128 - INFO - ✓ Successfully fetched data for: /m/01q82 (DE)
2026-01-05 04:06:22,128 - INFO - Waiting 3.6s before next request...
2026-01-05 04:06:25,682 - INFO - [2/5] DE - Processing: /g/1211cg58
2026-01-05 04:06:26,164 - INFO - ✓ Successfully fetched data for: /g/1211cg58 (DE)
2026-01-05 04:06:26,164 - INFO - Waiting 4.9s before next request...
2026-01-05 04:06:31,054 - INFO - [3/5] DE - Processing: /m/012_3l
2026-01-05 04:06:31,440 - INFO - ✓ Successfully fetched data for: /m/012_3l (DE)
2026-01-05 04:06:31,441 - INFO - Waiting 4.0s before next request...
2026-01-05 04:06:35,434 - INFO - [4/5] DE - Processing: /m/0gfps3
2026-01-05 04:06:35,983 - INFO - ✓ Successfully fetched data for: /m/0gfps3 (DE)
2026-01-05 04:06:35,984 - INFO - Waiting 5.8s before next request...
2026-01-05 04:06:41,816 - INFO - [5/5] DE - Processing: /g/11gbfbpzht
2026-01-05 04:06:42,306 - INFO - ✓ Successfully fetched data for: /g/11gbfbpzht (DE)
2026-01-05 04:06:42,316 - INFO - Saved master file for DE with 166 rows and 44 terms
2026-01-05 04:06:42,316 - INFO - 💾 Updated master file for DE with 5 new terms
2026-01-05 04:06:42,318 - INFO - 💾 Created backup: data/trends_results/trends_backup_DE_20260105_040642.csv
2026-01-05 04:06:42,318 - INFO - Waiting 10.2s before next country...
2026-01-05 04:06:52,564 - INFO - ============================================================
2026-01-05 04:06:52,564 - INFO - Processing country: KR (KR)
2026-01-05 04:06:52,564 - INFO - ============================================================
2026-01-05 04:06:52,567 - INFO - Loaded master file for KR with 166 rows and 39 terms
2026-01-05 04:06:52,567 - INFO - Processing batch of 5 terms for KR
2026-01-05 04:06:52,567 - INFO - Remaining terms after this batch: 0
2026-01-05 04:06:52,567 - INFO - [1/5] KR - Processing: /m/01q82
2026-01-05 04:06:52,907 - INFO - ✓ Successfully fetched data for: /m/01q82 (KR)
2026-01-05 04:06:52,907 - INFO - Waiting 4.7s before next request...
2026-01-05 04:06:57,562 - INFO - [2/5] KR - Processing: /g/1211cg58
2026-01-05 04:06:58,023 - INFO - ✓ Successfully fetched data for: /g/1211cg58 (KR)
2026-01-05 04:06:58,024 - INFO - Waiting 3.3s before next request...
2026-01-05 04:07:01,340 - INFO - [3/5] KR - Processing: /m/012_3l
2026-01-05 04:07:01,778 - INFO - ✓ Successfully fetched data for: /m/012_3l (KR)
2026-01-05 04:07:01,778 - INFO - Waiting 4.1s before next request...
2026-01-05 04:07:05,835 - INFO - [4/5] KR - Processing: /m/0gfps3
2026-01-05 04:07:06,409 - INFO - ✓ Successfully fetched data for: /m/0gfps3 (KR)
2026-01-05 04:07:06,409 - INFO - Waiting 4.2s before next request...
2026-01-05 04:07:10,588 - INFO - [5/5] KR - Processing: /g/11gbfbpzht
2026-01-05 04:07:11,114 - INFO - ✓ Successfully fetched data for: /g/11gbfbpzht (KR)
2026-01-05 04:07:11,124 - INFO - Saved master file for KR with 166 rows and 44 terms
2026-01-05 04:07:11,124 - INFO - 💾 Updated master file for KR with 5 new terms
2026-01-05 04:07:11,126 - INFO - 💾 Created backup: data/trends_results/trends_backup_KR_20260105_040711.csv
2026-01-05 04:07:11,126 - INFO - Waiting 7.1s before next country...
2026-01-05 04:07:18,203 - INFO - ============================================================
2026-01-05 04:07:18,203 - INFO - Processing country: LT (LT)
2026-01-05 04:07:18,203 - INFO - ============================================================
2026-01-05 04:07:18,206 - INFO - Loaded master file for LT with 166 rows and 39 terms
2026-01-05 04:07:18,206 - INFO - Processing batch of 5 terms for LT
2026-01-05 04:07:18,206 - INFO - Remaining terms after this batch: 0
2026-01-05 04:07:18,206 - INFO - [1/5] LT - Processing: /m/01q82
2026-01-05 04:07:18,667 - INFO - ✓ Successfully fetched data for: /m/01q82 (LT)
2026-01-05 04:07:18,667 - INFO - Waiting 3.3s before next request...
2026-01-05 04:07:21,988 - INFO - [2/5] LT - Processing: /g/1211cg58
2026-01-05 04:07:22,413 - INFO - ✓ Successfully fetched data for: /g/1211cg58 (LT)
2026-01-05 04:07:22,413 - INFO - Waiting 3.3s before next request...
2026-01-05 04:07:25,677 - INFO - [3/5] LT - Processing: /m/012_3l
2026-01-05 04:07:26,099 - INFO - ✓ Successfully fetched data for: /m/012_3l (LT)
2026-01-05 04:07:26,099 - INFO - Waiting 5.3s before next request...
2026-01-05 04:07:31,370 - INFO - [4/5] LT - Processing: /m/0gfps3
2026-01-05 04:07:31,888 - INFO - ✓ Successfully fetched data for: /m/0gfps3 (LT)
2026-01-05 04:07:31,888 - INFO - Waiting 4.6s before next request...
2026-01-05 04:07:36,476 - INFO - [5/5] LT - Processing: /g/11gbfbpzht
2026-01-05 04:07:37,979 - INFO - ✓ Successfully fetched data for: /g/11gbfbpzht (LT)
2026-01-05 04:07:37,989 - INFO - Saved master file for LT with 166 rows and 44 terms
2026-01-05 04:07:37,989 - INFO - 💾 Updated master file for LT with 5 new terms
2026-01-05 04:07:37,991 - INFO - 💾 Created backup: data/trends_results/trends_backup_LT_20260105_040737.csv
2026-01-05 04:07:37,991 - INFO - Waiting 11.0s before next country...
2026-01-05 04:07:48,958 - INFO - ============================================================
2026-01-05 04:07:48,958 - INFO - Processing country: NL (NL)
2026-01-05 04:07:48,958 - INFO - ============================================================
2026-01-05 04:07:48,960 - INFO - Loaded master file for NL with 166 rows and 39 terms
2026-01-05 04:07:48,961 - INFO - Processing batch of 5 terms for NL
2026-01-05 04:07:48,961 - INFO - Remaining terms after this batch: 0
2026-01-05 04:07:48,961 - INFO - [1/5] NL - Processing: /m/01q82
2026-01-05 04:07:49,336 - INFO - ✓ Successfully fetched data for: /m/01q82 (NL)
2026-01-05 04:07:49,337 - INFO - Waiting 5.9s before next request...
2026-01-05 04:07:55,194 - INFO - [2/5] NL - Processing: /g/1211cg58
2026-01-05 04:07:56,743 - INFO - ✓ Successfully fetched data for: /g/1211cg58 (NL)
2026-01-05 04:07:56,743 - INFO - Waiting 5.9s before next request...
2026-01-05 04:08:02,646 - INFO - [3/5] NL - Processing: /m/012_3l
2026-01-05 04:08:03,695 - INFO - ✓ Successfully fetched data for: /m/012_3l (NL)
2026-01-05 04:08:03,695 - INFO - Waiting 3.1s before next request...
2026-01-05 04:08:06,806 - INFO - [4/5] NL - Processing: /m/0gfps3
2026-01-05 04:08:08,118 - INFO - ✓ Successfully fetched data for: /m/0gfps3 (NL)
2026-01-05 04:08:08,118 - INFO - Waiting 5.5s before next request...
2026-01-05 04:08:13,578 - INFO - [5/5] NL - Processing: /g/11gbfbpzht
2026-01-05 04:08:14,446 - INFO - ✓ Successfully fetched data for: /g/11gbfbpzht (NL)
2026-01-05 04:08:14,456 - INFO - Saved master file for NL with 166 rows and 44 terms
2026-01-05 04:08:14,456 - INFO - 💾 Updated master file for NL with 5 new terms
2026-01-05 04:08:14,458 - INFO - 💾 Created backup: data/trends_results/trends_backup_NL_20260105_040814.csv
2026-01-05 04:08:14,458 - INFO - Waiting 8.7s before next country...
2026-01-05 04:08:23,183 - INFO - ============================================================
2026-01-05 04:08:23,183 - INFO - Processing country: SK (SK)
2026-01-05 04:08:23,183 - INFO - ============================================================
2026-01-05 04:08:23,186 - INFO - Loaded master file for SK with 166 rows and 39 terms
2026-01-05 04:08:23,186 - INFO - Processing batch of 5 terms for SK
2026-01-05 04:08:23,186 - INFO - Remaining terms after this batch: 0
2026-01-05 04:08:23,186 - INFO - [1/5] SK - Processing: /m/01q82
2026-01-05 04:08:23,760 - INFO - ✓ Successfully fetched data for: /m/01q82 (SK)
2026-01-05 04:08:23,760 - INFO - Waiting 5.3s before next request...
2026-01-05 04:08:29,098 - INFO - [2/5] SK - Processing: /g/1211cg58
2026-01-05 04:08:29,737 - INFO - ✓ Successfully fetched data for: /g/1211cg58 (SK)
2026-01-05 04:08:29,737 - INFO - Waiting 4.7s before next request...
2026-01-05 04:08:34,488 - INFO - [3/5] SK - Processing: /m/012_3l
2026-01-05 04:08:35,118 - INFO - ✓ Successfully fetched data for: /m/012_3l (SK)
2026-01-05 04:08:35,118 - INFO - Waiting 4.0s before next request...
2026-01-05 04:08:39,110 - INFO - [4/5] SK - Processing: /m/0gfps3
2026-01-05 04:08:39,773 - INFO - ✓ Successfully fetched data for: /m/0gfps3 (SK)
2026-01-05 04:08:39,774 - INFO - Waiting 5.3s before next request...
2026-01-05 04:08:45,121 - INFO - [5/5] SK - Processing: /g/11gbfbpzht
2026-01-05 04:08:45,598 - INFO - ✓ Successfully fetched data for: /g/11gbfbpzht (SK)
2026-01-05 04:08:45,608 - INFO - Saved master file for SK with 166 rows and 44 terms
2026-01-05 04:08:45,608 - INFO - 💾 Updated master file for SK with 5 new terms
2026-01-05 04:08:45,609 - INFO - 💾 Created backup: data/trends_results/trends_backup_SK_20260105_040845.csv
2026-01-05 04:08:45,609 - INFO - Waiting 11.7s before next country...
2026-01-05 04:08:57,340 - INFO - ============================================================
2026-01-05 04:08:57,340 - INFO - Processing country: HU (HU)
2026-01-05 04:08:57,340 - INFO - ============================================================
2026-01-05 04:08:57,343 - INFO - Loaded master file for HU with 166 rows and 39 terms
2026-01-05 04:08:57,343 - INFO - Processing batch of 5 terms for HU
2026-01-05 04:08:57,343 - INFO - Remaining terms after this batch: 0
2026-01-05 04:08:57,343 - INFO - [1/5] HU - Processing: /m/01q82
2026-01-05 04:08:57,775 - INFO - ✓ Successfully fetched data for: /m/01q82 (HU)
2026-01-05 04:08:57,775 - INFO - Waiting 3.6s before next request...
2026-01-05 04:09:01,395 - INFO - [2/5] HU - Processing: /g/1211cg58
2026-01-05 04:09:01,815 - INFO - ✓ Successfully fetched data for: /g/1211cg58 (HU)
2026-01-05 04:09:01,816 - INFO - Waiting 3.1s before next request...
2026-01-05 04:09:04,964 - INFO - [3/5] HU - Processing: /m/012_3l
2026-01-05 04:09:05,362 - INFO - ✓ Successfully fetched data for: /m/012_3l (HU)
2026-01-05 04:09:05,362 - INFO - Waiting 4.8s before next request...
2026-01-05 04:09:10,205 - INFO - [4/5] HU - Processing: /m/0gfps3
2026-01-05 04:09:10,663 - INFO - ✓ Successfully fetched data for: /m/0gfps3 (HU)
2026-01-05 04:09:10,663 - INFO - Waiting 4.8s before next request...
2026-01-05 04:09:15,420 - INFO - [5/5] HU - Processing: /g/11gbfbpzht
2026-01-05 04:09:15,893 - INFO - ✓ Successfully fetched data for: /g/11gbfbpzht (HU)
2026-01-05 04:09:15,903 - INFO - Saved master file for HU with 166 rows and 44 terms
2026-01-05 04:09:15,903 - INFO - 💾 Updated master file for HU with 5 new terms
2026-01-05 04:09:15,905 - INFO - 💾 Created backup: data/trends_results/trends_backup_HU_20260105_040915.csv
2026-01-05 04:09:15,905 - INFO - Waiting 10.7s before next country...
2026-01-05 04:09:26,624 - INFO - ============================================================
2026-01-05 04:09:26,624 - INFO - Processing country: LV (LV)
2026-01-05 04:09:26,624 - INFO - ============================================================
2026-01-05 04:09:26,627 - INFO - Loaded master file for LV with 166 rows and 39 terms
2026-01-05 04:09:26,627 - INFO - Processing batch of 5 terms for LV
2026-01-05 04:09:26,627 - INFO - Remaining terms after this batch: 0
2026-01-05 04:09:26,627 - INFO - [1/5] LV - Processing: /m/01q82
2026-01-05 04:09:27,051 - INFO - ✓ Successfully fetched data for: /m/01q82 (LV)
2026-01-05 04:09:27,052 - INFO - Waiting 6.0s before next request...
2026-01-05 04:09:33,040 - INFO - [2/5] LV - Processing: /g/1211cg58
2026-01-05 04:09:33,441 - INFO - ✓ Successfully fetched data for: /g/1211cg58 (LV)
2026-01-05 04:09:33,442 - INFO - Waiting 6.0s before next request...
2026-01-05 04:09:39,437 - INFO - [3/5] LV - Processing: /m/012_3l
2026-01-05 04:09:39,881 - INFO - ✓ Successfully fetched data for: /m/012_3l (LV)
2026-01-05 04:09:39,882 - INFO - Waiting 5.5s before next request...
2026-01-05 04:09:45,410 - INFO - [4/5] LV - Processing: /m/0gfps3
2026-01-05 04:09:45,848 - INFO - ✓ Successfully fetched data for: /m/0gfps3 (LV)
2026-01-05 04:09:45,848 - INFO - Waiting 3.4s before next request...
2026-01-05 04:09:49,296 - INFO - [5/5] LV - Processing: /g/11gbfbpzht
2026-01-05 04:09:49,768 - INFO - ✓ Successfully fetched data for: /g/11gbfbpzht (LV)
2026-01-05 04:09:49,778 - INFO - Saved master file for LV with 166 rows and 44 terms
2026-01-05 04:09:49,778 - INFO - 💾 Updated master file for LV with 5 new terms
2026-01-05 04:09:49,780 - INFO - 💾 Created backup: data/trends_results/trends_backup_LV_20260105_040949.csv
2026-01-05 04:09:49,780 - INFO - Waiting 7.4s before next country...
2026-01-05 04:09:57,177 - INFO - ============================================================
2026-01-05 04:09:57,177 - INFO - Processing country: PL (PL)
2026-01-05 04:09:57,177 - INFO - ============================================================
2026-01-05 04:09:57,180 - INFO - Loaded master file for PL with 166 rows and 39 terms
2026-01-05 04:09:57,180 - INFO - Processing batch of 5 terms for PL
2026-01-05 04:09:57,180 - INFO - Remaining terms after this batch: 0
2026-01-05 04:09:57,180 - INFO - [1/5] PL - Processing: /m/01q82
2026-01-05 04:09:57,645 - INFO - ✓ Successfully fetched data for: /m/01q82 (PL)
2026-01-05 04:09:57,645 - INFO - Waiting 3.7s before next request...
2026-01-05 04:10:01,396 - INFO - [2/5] PL - Processing: /g/1211cg58
2026-01-05 04:10:01,843 - INFO - ✓ Successfully fetched data for: /g/1211cg58 (PL)
2026-01-05 04:10:01,843 - INFO - Waiting 4.6s before next request...
2026-01-05 04:10:06,444 - INFO - [3/5] PL - Processing: /m/012_3l
2026-01-05 04:10:06,867 - INFO - ✓ Successfully fetched data for: /m/012_3l (PL)
2026-01-05 04:10:06,868 - INFO - Waiting 3.4s before next request...
2026-01-05 04:10:10,258 - INFO - [4/5] PL - Processing: /m/0gfps3
2026-01-05 04:10:10,876 - INFO - ✓ Successfully fetched data for: /m/0gfps3 (PL)
2026-01-05 04:10:10,876 - INFO - Waiting 4.7s before next request...
2026-01-05 04:10:15,548 - INFO - [5/5] PL - Processing: /g/11gbfbpzht
2026-01-05 04:10:16,206 - INFO - ✓ Successfully fetched data for: /g/11gbfbpzht (PL)
2026-01-05 04:10:16,216 - INFO - Saved master file for PL with 166 rows and 44 terms
2026-01-05 04:10:16,216 - INFO - 💾 Updated master file for PL with 5 new terms
2026-01-05 04:10:16,217 - INFO - 💾 Created backup: data/trends_results/trends_backup_PL_20260105_041016.csv
2026-01-05 04:10:16,217 - INFO - Waiting 6.8s before next country...
2026-01-05 04:10:23,020 - INFO - ============================================================
2026-01-05 04:10:23,020 - INFO - Processing country: PT (PT)
2026-01-05 04:10:23,020 - INFO - ============================================================
2026-01-05 04:10:23,023 - INFO - Loaded master file for PT with 166 rows and 39 terms
2026-01-05 04:10:23,023 - INFO - Processing batch of 5 terms for PT
2026-01-05 04:10:23,023 - INFO - Remaining terms after this batch: 0
2026-01-05 04:10:23,023 - INFO - [1/5] PT - Processing: /m/01q82
2026-01-05 04:10:23,597 - INFO - ✓ Successfully fetched data for: /m/01q82 (PT)
2026-01-05 04:10:23,597 - INFO - Waiting 4.4s before next request...
2026-01-05 04:10:28,044 - INFO - [2/5] PT - Processing: /g/1211cg58
2026-01-05 04:10:29,927 - INFO - ✓ Successfully fetched data for: /g/1211cg58 (PT)
2026-01-05 04:10:29,927 - INFO - Waiting 5.2s before next request...
2026-01-05 04:10:35,172 - INFO - [3/5] PT - Processing: /m/012_3l
2026-01-05 04:10:36,454 - INFO - ✓ Successfully fetched data for: /m/012_3l (PT)
2026-01-05 04:10:36,454 - INFO - Waiting 3.7s before next request...
2026-01-05 04:10:40,148 - INFO - [4/5] PT - Processing: /m/0gfps3
2026-01-05 04:10:41,461 - INFO - ✓ Successfully fetched data for: /m/0gfps3 (PT)
2026-01-05 04:10:41,461 - INFO - Waiting 3.8s before next request...
2026-01-05 04:10:45,249 - INFO - [5/5] PT - Processing: /g/11gbfbpzht
2026-01-05 04:10:46,085 - INFO - ✓ Successfully fetched data for: /g/11gbfbpzht (PT)
2026-01-05 04:10:46,094 - INFO - Saved master file for PT with 166 rows and 44 terms
2026-01-05 04:10:46,095 - INFO - 💾 Updated master file for PT with 5 new terms
2026-01-05 04:10:46,096 - INFO - 💾 Created backup: data/trends_results/trends_backup_PT_20260105_041046.csv
2026-01-05 04:10:46,096 - INFO - Waiting 9.0s before next country...
2026-01-05 04:10:55,066 - INFO - ============================================================
2026-01-05 04:10:55,067 - INFO - Processing country: IL (IL)
2026-01-05 04:10:55,067 - INFO - ============================================================
2026-01-05 04:10:55,069 - INFO - Loaded master file for IL with 166 rows and 39 terms
2026-01-05 04:10:55,070 - INFO - Processing batch of 5 terms for IL
2026-01-05 04:10:55,070 - INFO - Remaining terms after this batch: 0
2026-01-05 04:10:55,070 - INFO - [1/5] IL - Processing: /m/01q82
2026-01-05 04:10:55,732 - INFO - ✓ Successfully fetched data for: /m/01q82 (IL)
2026-01-05 04:10:55,732 - INFO - Waiting 4.5s before next request...
2026-01-05 04:11:00,283 - INFO - [2/5] IL - Processing: /g/1211cg58
2026-01-05 04:11:00,956 - INFO - ✓ Successfully fetched data for: /g/1211cg58 (IL)
2026-01-05 04:11:00,956 - INFO - Waiting 3.3s before next request...
2026-01-05 04:11:04,297 - INFO - [3/5] IL - Processing: /m/012_3l
2026-01-05 04:11:04,962 - INFO - ✓ Successfully fetched data for: /m/012_3l (IL)
2026-01-05 04:11:04,962 - INFO - Waiting 3.5s before next request...
2026-01-05 04:11:08,454 - INFO - [4/5] IL - Processing: /m/0gfps3
2026-01-05 04:11:09,153 - INFO - ✓ Successfully fetched data for: /m/0gfps3 (IL)
2026-01-05 04:11:09,153 - INFO - Waiting 4.4s before next request...
2026-01-05 04:11:13,522 - INFO - [5/5] IL - Processing: /g/11gbfbpzht
2026-01-05 04:11:14,225 - INFO - ✓ Successfully fetched data for: /g/11gbfbpzht (IL)
2026-01-05 04:11:14,235 - INFO - Saved master file for IL with 166 rows and 44 terms
2026-01-05 04:11:14,235 - INFO - 💾 Updated master file for IL with 5 new terms
2026-01-05 04:11:14,237 - INFO - 💾 Created backup: data/trends_results/trends_backup_IL_20260105_041114.csv
2026-01-05 04:11:14,237 - INFO - Waiting 10.7s before next country...
2026-01-05 04:11:24,973 - INFO - ============================================================
2026-01-05 04:11:24,973 - INFO - Processing country: IT (IT)
2026-01-05 04:11:24,973 - INFO - ============================================================
2026-01-05 04:11:24,976 - INFO - Loaded master file for IT with 166 rows and 39 terms
2026-01-05 04:11:24,976 - INFO - Processing batch of 5 terms for IT
2026-01-05 04:11:24,976 - INFO - Remaining terms after this batch: 0
2026-01-05 04:11:24,976 - INFO - [1/5] IT - Processing: /m/01q82
2026-01-05 04:11:25,672 - INFO - ✓ Successfully fetched data for: /m/01q82 (IT)
2026-01-05 04:11:25,672 - INFO - Waiting 4.2s before next request...
2026-01-05 04:11:29,896 - INFO - [2/5] IT - Processing: /g/1211cg58
2026-01-05 04:11:30,559 - INFO - ✓ Successfully fetched data for: /g/1211cg58 (IT)
2026-01-05 04:11:30,559 - INFO - Waiting 3.7s before next request...
2026-01-05 04:11:34,272 - INFO - [3/5] IT - Processing: /m/012_3l
2026-01-05 04:11:35,429 - INFO - ✓ Successfully fetched data for: /m/012_3l (IT)
2026-01-05 04:11:35,429 - INFO - Waiting 5.0s before next request...
2026-01-05 04:11:40,475 - INFO - [4/5] IT - Processing: /m/0gfps3
2026-01-05 04:11:41,394 - INFO - ✓ Successfully fetched data for: /m/0gfps3 (IT)
2026-01-05 04:11:41,394 - INFO - Waiting 4.6s before next request...
2026-01-05 04:11:46,025 - INFO - [5/5] IT - Processing: /g/11gbfbpzht
2026-01-05 04:11:46,645 - INFO - ✓ Successfully fetched data for: /g/11gbfbpzht (IT)
2026-01-05 04:11:46,655 - INFO - Saved master file for IT with 166 rows and 44 terms
2026-01-05 04:11:46,655 - INFO - 💾 Updated master file for IT with 5 new terms
2026-01-05 04:11:46,656 - INFO - 💾 Created backup: data/trends_results/trends_backup_IT_20260105_041146.csv
2026-01-05 04:11:46,657 - INFO - Waiting 11.9s before next country...
2026-01-05 04:11:58,615 - INFO - ============================================================
2026-01-05 04:11:58,615 - INFO - Processing country: CR (CR)
2026-01-05 04:11:58,616 - INFO - ============================================================
2026-01-05 04:11:58,618 - INFO - Loaded master file for CR with 166 rows and 39 terms
2026-01-05 04:11:58,618 - INFO - Processing batch of 5 terms for CR
2026-01-05 04:11:58,618 - INFO - Remaining terms after this batch: 0
2026-01-05 04:11:58,618 - INFO - [1/5] CR - Processing: /m/01q82
2026-01-05 04:11:59,141 - INFO - ✓ Successfully fetched data for: /m/01q82 (CR)
2026-01-05 04:11:59,141 - INFO - Waiting 5.2s before next request...
2026-01-05 04:12:04,321 - INFO - [2/5] CR - Processing: /g/1211cg58
2026-01-05 04:12:04,754 - INFO - ✓ Successfully fetched data for: /g/1211cg58 (CR)
2026-01-05 04:12:04,754 - INFO - Waiting 4.7s before next request...
2026-01-05 04:12:09,433 - INFO - [3/5] CR - Processing: /m/012_3l
2026-01-05 04:12:09,866 - INFO - ✓ Successfully fetched data for: /m/012_3l (CR)
2026-01-05 04:12:09,866 - INFO - Waiting 4.7s before next request...
2026-01-05 04:12:14,598 - INFO - [4/5] CR - Processing: /m/0gfps3
2026-01-05 04:12:15,076 - INFO - ✓ Successfully fetched data for: /m/0gfps3 (CR)
2026-01-05 04:12:15,076 - INFO - Waiting 3.8s before next request...
2026-01-05 04:12:18,865 - INFO - [5/5] CR - Processing: /g/11gbfbpzht
2026-01-05 04:12:19,462 - INFO - ✓ Successfully fetched data for: /g/11gbfbpzht (CR)
2026-01-05 04:12:19,472 - INFO - Saved master file for CR with 166 rows and 44 terms
2026-01-05 04:12:19,472 - INFO - 💾 Updated master file for CR with 5 new terms
2026-01-05 04:12:19,473 - INFO - 💾 Created backup: data/trends_results/trends_backup_CR_20260105_041219.csv
2026-01-05 04:12:19,474 - INFO - Waiting 7.9s before next country...
2026-01-05 04:12:27,430 - INFO - ============================================================
2026-01-05 04:12:27,430 - INFO - Processing country: BE (BE)
2026-01-05 04:12:27,430 - INFO - ============================================================
2026-01-05 04:12:27,433 - INFO - Loaded master file for BE with 166 rows and 39 terms
2026-01-05 04:12:27,433 - INFO - Processing batch of 5 terms for BE
2026-01-05 04:12:27,433 - INFO - Remaining terms after this batch: 0
2026-01-05 04:12:27,433 - INFO - [1/5] BE - Processing: /m/01q82
2026-01-05 04:12:28,113 - INFO - ✓ Successfully fetched data for: /m/01q82 (BE)
2026-01-05 04:12:28,113 - INFO - Waiting 4.2s before next request...
2026-01-05 04:12:32,326 - INFO - [2/5] BE - Processing: /g/1211cg58
2026-01-05 04:12:33,005 - INFO - ✓ Successfully fetched data for: /g/1211cg58 (BE)
2026-01-05 04:12:33,005 - INFO - Waiting 3.9s before next request...
2026-01-05 04:12:36,935 - INFO - [3/5] BE - Processing: /m/012_3l
2026-01-05 04:12:37,409 - INFO - ✓ Successfully fetched data for: /m/012_3l (BE)
2026-01-05 04:12:37,410 - INFO - Waiting 4.9s before next request...
2026-01-05 04:12:42,311 - INFO - [4/5] BE - Processing: /m/0gfps3
2026-01-05 04:12:42,944 - INFO - ✓ Successfully fetched data for: /m/0gfps3 (BE)
2026-01-05 04:12:42,944 - INFO - Waiting 4.5s before next request...
2026-01-05 04:12:47,495 - INFO - [5/5] BE - Processing: /g/11gbfbpzht
2026-01-05 04:12:48,520 - INFO - ✓ Successfully fetched data for: /g/11gbfbpzht (BE)
2026-01-05 04:12:48,529 - INFO - Saved master file for BE with 166 rows and 44 terms
2026-01-05 04:12:48,529 - INFO - 💾 Updated master file for BE with 5 new terms
2026-01-05 04:12:48,531 - INFO - 💾 Created backup: data/trends_results/trends_backup_BE_20260105_041248.csv
2026-01-05 04:12:48,531 - INFO - Waiting 8.9s before next country...
2026-01-05 04:12:57,453 - INFO - ============================================================
2026-01-05 04:12:57,453 - INFO - Processing country: CZ (CZ)
2026-01-05 04:12:57,454 - INFO - ============================================================
2026-01-05 04:12:57,456 - INFO - Loaded master file for CZ with 166 rows and 39 terms
2026-01-05 04:12:57,456 - INFO - Processing batch of 5 terms for CZ
2026-01-05 04:12:57,456 - INFO - Remaining terms after this batch: 0
2026-01-05 04:12:57,456 - INFO - [1/5] CZ - Processing: /m/01q82
2026-01-05 04:12:58,039 - INFO - ✓ Successfully fetched data for: /m/01q82 (CZ)
2026-01-05 04:12:58,040 - INFO - Waiting 3.6s before next request...
2026-01-05 04:13:01,662 - INFO - [2/5] CZ - Processing: /g/1211cg58
2026-01-05 04:13:02,353 - INFO - ✓ Successfully fetched data for: /g/1211cg58 (CZ)
2026-01-05 04:13:02,353 - INFO - Waiting 5.3s before next request...
2026-01-05 04:13:07,623 - INFO - [3/5] CZ - Processing: /m/012_3l
2026-01-05 04:13:08,220 - INFO - ✓ Successfully fetched data for: /m/012_3l (CZ)
2026-01-05 04:13:08,220 - INFO - Waiting 3.9s before next request...
2026-01-05 04:13:12,132 - INFO - [4/5] CZ - Processing: /m/0gfps3
2026-01-05 04:13:12,602 - INFO - ✓ Successfully fetched data for: /m/0gfps3 (CZ)
2026-01-05 04:13:12,602 - INFO - Waiting 4.0s before next request...
2026-01-05 04:13:16,598 - INFO - [5/5] CZ - Processing: /g/11gbfbpzht
2026-01-05 04:13:17,162 - INFO - ✓ Successfully fetched data for: /g/11gbfbpzht (CZ)
2026-01-05 04:13:17,172 - INFO - Saved master file for CZ with 166 rows and 44 terms
2026-01-05 04:13:17,172 - INFO - 💾 Updated master file for CZ with 5 new terms
2026-01-05 04:13:17,173 - INFO - 💾 Created backup: data/trends_results/trends_backup_CZ_20260105_041317.csv
2026-01-05 04:13:17,173 - INFO - Waiting 8.5s before next country...
2026-01-05 04:13:25,661 - INFO - ============================================================
2026-01-05 04:13:25,661 - INFO - Processing country: GR (GR)
2026-01-05 04:13:25,661 - INFO - ============================================================
2026-01-05 04:13:25,664 - INFO - Loaded master file for GR with 166 rows and 39 terms
2026-01-05 04:13:25,664 - INFO - Processing batch of 5 terms for GR
2026-01-05 04:13:25,664 - INFO - Remaining terms after this batch: 0
2026-01-05 04:13:25,664 - INFO - [1/5] GR - Processing: /m/01q82
2026-01-05 04:13:26,086 - INFO - ✓ Successfully fetched data for: /m/01q82 (GR)
2026-01-05 04:13:26,086 - INFO - Waiting 5.0s before next request...
2026-01-05 04:13:31,043 - INFO - [2/5] GR - Processing: /g/1211cg58
2026-01-05 04:13:31,465 - INFO - ✓ Successfully fetched data for: /g/1211cg58 (GR)
2026-01-05 04:13:31,465 - INFO - Waiting 5.5s before next request...
2026-01-05 04:13:36,921 - INFO - [3/5] GR - Processing: /m/012_3l
2026-01-05 04:13:37,366 - INFO - ✓ Successfully fetched data for: /m/012_3l (GR)
2026-01-05 04:13:37,366 - INFO - Waiting 4.5s before next request...
2026-01-05 04:13:41,888 - INFO - [4/5] GR - Processing: /m/0gfps3
2026-01-05 04:13:42,526 - INFO - ✓ Successfully fetched data for: /m/0gfps3 (GR)
2026-01-05 04:13:42,527 - INFO - Waiting 3.8s before next request...
2026-01-05 04:13:46,321 - INFO - [5/5] GR - Processing: /g/11gbfbpzht
2026-01-05 04:13:46,885 - INFO - ✓ Successfully fetched data for: /g/11gbfbpzht (GR)
2026-01-05 04:13:46,895 - INFO - Saved master file for GR with 166 rows and 44 terms
2026-01-05 04:13:46,895 - INFO - 💾 Updated master file for GR with 5 new terms
2026-01-05 04:13:46,896 - INFO - 💾 Created backup: data/trends_results/trends_backup_GR_20260105_041346.csv
2026-01-05 04:13:46,896 - INFO - Waiting 7.0s before next country...
2026-01-05 04:13:53,868 - INFO - ============================================================
2026-01-05 04:13:53,869 - INFO - Processing country: NZ (NZ)
2026-01-05 04:13:53,869 - INFO - ============================================================
2026-01-05 04:13:53,872 - INFO - Loaded master file for NZ with 166 rows and 39 terms
2026-01-05 04:13:53,872 - INFO - Processing batch of 5 terms for NZ
2026-01-05 04:13:53,872 - INFO - Remaining terms after this batch: 0
2026-01-05 04:13:53,872 - INFO - [1/5] NZ - Processing: /m/01q82
2026-01-05 04:13:54,306 - INFO - ✓ Successfully fetched data for: /m/01q82 (NZ)
2026-01-05 04:13:54,307 - INFO - Waiting 5.3s before next request...
2026-01-05 04:13:59,567 - INFO - [2/5] NZ - Processing: /g/1211cg58
2026-01-05 04:13:59,968 - INFO - ✓ Successfully fetched data for: /g/1211cg58 (NZ)
2026-01-05 04:13:59,968 - INFO - Waiting 4.9s before next request...
2026-01-05 04:14:04,881 - INFO - [3/5] NZ - Processing: /m/012_3l
2026-01-05 04:14:05,314 - INFO - ✓ Successfully fetched data for: /m/012_3l (NZ)
2026-01-05 04:14:05,314 - INFO - Waiting 4.4s before next request...
2026-01-05 04:14:09,674 - INFO - [4/5] NZ - Processing: /m/0gfps3
2026-01-05 04:14:10,278 - INFO - ✓ Successfully fetched data for: /m/0gfps3 (NZ)
2026-01-05 04:14:10,278 - INFO - Waiting 4.5s before next request...
2026-01-05 04:14:14,767 - INFO - [5/5] NZ - Processing: /g/11gbfbpzht
2026-01-05 04:14:15,853 - INFO - ✓ Successfully fetched data for: /g/11gbfbpzht (NZ)
2026-01-05 04:14:15,863 - INFO - Saved master file for NZ with 166 rows and 44 terms
2026-01-05 04:14:15,863 - INFO - 💾 Updated master file for NZ with 5 new terms
2026-01-05 04:14:15,865 - INFO - 💾 Created backup: data/trends_results/trends_backup_NZ_20260105_041415.csv
2026-01-05 04:14:15,865 - INFO - Waiting 9.9s before next country...
2026-01-05 04:14:25,765 - INFO - ============================================================
2026-01-05 04:14:25,765 - INFO - Processing country: MX (MX)
2026-01-05 04:14:25,765 - INFO - ============================================================
2026-01-05 04:14:25,768 - INFO - Loaded master file for MX with 166 rows and 39 terms
2026-01-05 04:14:25,768 - INFO - Processing batch of 5 terms for MX
2026-01-05 04:14:25,768 - INFO - Remaining terms after this batch: 0
2026-01-05 04:14:25,768 - INFO - [1/5] MX - Processing: /m/01q82
2026-01-05 04:14:27,054 - INFO - ✓ Successfully fetched data for: /m/01q82 (MX)
2026-01-05 04:14:27,054 - INFO - Waiting 4.3s before next request...
2026-01-05 04:14:31,386 - INFO - [2/5] MX - Processing: /g/1211cg58
2026-01-05 04:14:32,209 - INFO - ✓ Successfully fetched data for: /g/1211cg58 (MX)
2026-01-05 04:14:32,209 - INFO - Waiting 3.5s before next request...
2026-01-05 04:14:35,726 - INFO - [3/5] MX - Processing: /m/012_3l
2026-01-05 04:14:36,449 - INFO - ✓ Successfully fetched data for: /m/012_3l (MX)
2026-01-05 04:14:36,449 - INFO - Waiting 3.6s before next request...
2026-01-05 04:14:40,069 - INFO - [4/5] MX - Processing: /m/0gfps3
2026-01-05 04:14:41,007 - INFO - ✓ Successfully fetched data for: /m/0gfps3 (MX)
2026-01-05 04:14:41,007 - INFO - Waiting 4.3s before next request...
2026-01-05 04:14:45,268 - INFO - [5/5] MX - Processing: /g/11gbfbpzht
2026-01-05 04:14:46,218 - INFO - ✓ Successfully fetched data for: /g/11gbfbpzht (MX)
2026-01-05 04:14:46,227 - INFO - Saved master file for MX with 166 rows and 44 terms
2026-01-05 04:14:46,228 - INFO - 💾 Updated master file for MX with 5 new terms
2026-01-05 04:14:46,229 - INFO - 💾 Created backup: data/trends_results/trends_backup_MX_20260105_041446.csv
2026-01-05 04:14:46,229 - INFO - Waiting 10.1s before next country...
2026-01-05 04:14:56,327 - INFO - ============================================================
2026-01-05 04:14:56,327 - INFO - Processing country: LU (LU)
2026-01-05 04:14:56,327 - INFO - ============================================================
2026-01-05 04:14:56,330 - INFO - Loaded master file for LU with 166 rows and 39 terms
2026-01-05 04:14:56,330 - INFO - Processing batch of 5 terms for LU
2026-01-05 04:14:56,330 - INFO - Remaining terms after this batch: 0
2026-01-05 04:14:56,330 - INFO - [1/5] LU - Processing: /m/01q82
2026-01-05 04:14:56,986 - INFO - ✓ Successfully fetched data for: /m/01q82 (LU)
2026-01-05 04:14:56,986 - INFO - Waiting 4.9s before next request...
2026-01-05 04:15:01,882 - INFO - [2/5] LU - Processing: /g/1211cg58
2026-01-05 04:15:02,551 - INFO - ✓ Successfully fetched data for: /g/1211cg58 (LU)
2026-01-05 04:15:02,551 - INFO - Waiting 3.6s before next request...
2026-01-05 04:15:06,109 - INFO - [3/5] LU - Processing: /m/012_3l
2026-01-05 04:15:06,784 - INFO - ✓ Successfully fetched data for: /m/012_3l (LU)
2026-01-05 04:15:06,785 - INFO - Waiting 5.9s before next request...
2026-01-05 04:15:12,707 - INFO - [4/5] LU - Processing: /m/0gfps3
2026-01-05 04:15:13,385 - INFO - ✓ Successfully fetched data for: /m/0gfps3 (LU)
2026-01-05 04:15:13,385 - INFO - Waiting 4.3s before next request...
2026-01-05 04:15:17,726 - INFO - [5/5] LU - Processing: /g/11gbfbpzht
2026-01-05 04:15:18,409 - INFO - ✓ Successfully fetched data for: /g/11gbfbpzht (LU)
2026-01-05 04:15:18,419 - INFO - Saved master file for LU with 166 rows and 44 terms
2026-01-05 04:15:18,419 - INFO - 💾 Updated master file for LU with 5 new terms
2026-01-05 04:15:18,420 - INFO - 💾 Created backup: data/trends_results/trends_backup_LU_20260105_041518.csv
2026-01-05 04:15:18,420 - INFO - Waiting 7.5s before next country...
2026-01-05 04:15:25,888 - INFO - ============================================================
2026-01-05 04:15:25,889 - INFO - Processing country: AT (AT)
2026-01-05 04:15:25,889 - INFO - ============================================================
2026-01-05 04:15:25,891 - INFO - Loaded master file for AT with 166 rows and 39 terms
2026-01-05 04:15:25,892 - INFO - Processing batch of 5 terms for AT
2026-01-05 04:15:25,892 - INFO - Remaining terms after this batch: 0
2026-01-05 04:15:25,892 - INFO - [1/5] AT - Processing: /m/01q82
2026-01-05 04:15:26,561 - INFO - ✓ Successfully fetched data for: /m/01q82 (AT)
2026-01-05 04:15:26,562 - INFO - Waiting 5.7s before next request...
2026-01-05 04:15:32,262 - INFO - [2/5] AT - Processing: /g/1211cg58
2026-01-05 04:15:32,919 - INFO - ✓ Successfully fetched data for: /g/1211cg58 (AT)
2026-01-05 04:15:32,919 - INFO - Waiting 4.4s before next request...
2026-01-05 04:15:37,342 - INFO - [3/5] AT - Processing: /m/012_3l
2026-01-05 04:15:38,008 - INFO - ✓ Successfully fetched data for: /m/012_3l (AT)
2026-01-05 04:15:38,008 - INFO - Waiting 3.8s before next request...
2026-01-05 04:15:41,843 - INFO - [4/5] AT - Processing: /m/0gfps3
2026-01-05 04:15:42,583 - INFO - ✓ Successfully fetched data for: /m/0gfps3 (AT)
2026-01-05 04:15:42,583 - INFO - Waiting 5.6s before next request...
2026-01-05 04:15:48,151 - INFO - [5/5] AT - Processing: /g/11gbfbpzht
2026-01-05 04:15:49,403 - INFO - ✓ Successfully fetched data for: /g/11gbfbpzht (AT)
2026-01-05 04:15:49,412 - INFO - Saved master file for AT with 166 rows and 44 terms
2026-01-05 04:15:49,413 - INFO - 💾 Updated master file for AT with 5 new terms
2026-01-05 04:15:49,414 - INFO - 💾 Created backup: data/trends_results/trends_backup_AT_20260105_041549.csv
2026-01-05 04:15:49,414 - INFO - Waiting 11.7s before next country...
2026-01-05 04:16:01,152 - INFO - ============================================================
2026-01-05 04:16:01,152 - INFO - Processing country: JP (JP)
2026-01-05 04:16:01,152 - INFO - ============================================================
2026-01-05 04:16:01,155 - INFO - Loaded master file for JP with 166 rows and 39 terms
2026-01-05 04:16:01,155 - INFO - Processing batch of 5 terms for JP
2026-01-05 04:16:01,155 - INFO - Remaining terms after this batch: 0
2026-01-05 04:16:01,155 - INFO - [1/5] JP - Processing: /m/01q82
2026-01-05 04:16:01,546 - INFO - ✓ Successfully fetched data for: /m/01q82 (JP)
2026-01-05 04:16:01,546 - INFO - Waiting 4.9s before next request...
2026-01-05 04:16:06,501 - INFO - [2/5] JP - Processing: /g/1211cg58
2026-01-05 04:16:06,984 - INFO - ✓ Successfully fetched data for: /g/1211cg58 (JP)
2026-01-05 04:16:06,984 - INFO - Waiting 4.6s before next request...
2026-01-05 04:16:11,631 - INFO - [3/5] JP - Processing: /m/012_3l
2026-01-05 04:16:12,020 - INFO - ✓ Successfully fetched data for: /m/012_3l (JP)
2026-01-05 04:16:12,020 - INFO - Waiting 4.8s before next request...
2026-01-05 04:16:16,865 - INFO - [4/5] JP - Processing: /m/0gfps3
2026-01-05 04:16:17,377 - INFO - ✓ Successfully fetched data for: /m/0gfps3 (JP)
2026-01-05 04:16:17,378 - INFO - Waiting 5.3s before next request...
2026-01-05 04:16:22,699 - INFO - [5/5] JP - Processing: /g/11gbfbpzht
2026-01-05 04:16:23,251 - INFO - ✓ Successfully fetched data for: /g/11gbfbpzht (JP)
2026-01-05 04:16:23,260 - INFO - Saved master file for JP with 166 rows and 44 terms
2026-01-05 04:16:23,260 - INFO - 💾 Updated master file for JP with 5 new terms
2026-01-05 04:16:23,262 - INFO - 💾 Created backup: data/trends_results/trends_backup_JP_20260105_041623.csv
2026-01-05 04:16:23,262 - INFO - Waiting 6.2s before next country...
2026-01-05 04:16:29,450 - INFO - ============================================================
2026-01-05 04:16:29,450 - INFO - Processing country: IE (IE)
2026-01-05 04:16:29,451 - INFO - ============================================================
2026-01-05 04:16:29,453 - INFO - Loaded master file for IE with 166 rows and 39 terms
2026-01-05 04:16:29,453 - INFO - Processing batch of 5 terms for IE
2026-01-05 04:16:29,453 - INFO - Remaining terms after this batch: 0
2026-01-05 04:16:29,453 - INFO - [1/5] IE - Processing: /m/01q82
2026-01-05 04:16:30,029 - INFO - ✓ Successfully fetched data for: /m/01q82 (IE)
2026-01-05 04:16:30,029 - INFO - Waiting 4.6s before next request...
2026-01-05 04:16:34,643 - INFO - [2/5] IE - Processing: /g/1211cg58
2026-01-05 04:16:35,415 - INFO - ✓ Successfully fetched data for: /g/1211cg58 (IE)
2026-01-05 04:16:35,415 - INFO - Waiting 3.0s before next request...
2026-01-05 04:16:38,422 - INFO - [3/5] IE - Processing: /m/012_3l
2026-01-05 04:16:38,905 - INFO - ✓ Successfully fetched data for: /m/012_3l (IE)
2026-01-05 04:16:38,906 - INFO - Waiting 3.4s before next request...
2026-01-05 04:16:42,319 - INFO - [4/5] IE - Processing: /m/0gfps3
2026-01-05 04:16:42,833 - INFO - ✓ Successfully fetched data for: /m/0gfps3 (IE)
2026-01-05 04:16:42,833 - INFO - Waiting 4.5s before next request...
2026-01-05 04:16:47,379 - INFO - [5/5] IE - Processing: /g/11gbfbpzht
2026-01-05 04:16:47,912 - INFO - ✓ Successfully fetched data for: /g/11gbfbpzht (IE)
2026-01-05 04:16:47,922 - INFO - Saved master file for IE with 166 rows and 44 terms
2026-01-05 04:16:47,922 - INFO - 💾 Updated master file for IE with 5 new terms
2026-01-05 04:16:47,924 - INFO - 💾 Created backup: data/trends_results/trends_backup_IE_20260105_041647.csv
2026-01-05 04:16:47,924 - INFO - Waiting 6.1s before next country...
2026-01-05 04:16:54,031 - INFO - ============================================================
2026-01-05 04:16:54,031 - INFO - Processing country: SI (SI)
2026-01-05 04:16:54,031 - INFO - ============================================================
2026-01-05 04:16:54,034 - INFO - Loaded master file for SI with 166 rows and 39 terms
2026-01-05 04:16:54,034 - INFO - Processing batch of 5 terms for SI
2026-01-05 04:16:54,034 - INFO - Remaining terms after this batch: 0
2026-01-05 04:16:54,034 - INFO - [1/5] SI - Processing: /m/01q82
2026-01-05 04:16:54,377 - INFO - ✓ Successfully fetched data for: /m/01q82 (SI)
2026-01-05 04:16:54,377 - INFO - Waiting 3.0s before next request...
2026-01-05 04:16:57,403 - INFO - [2/5] SI - Processing: /g/1211cg58
2026-01-05 04:16:57,747 - INFO - ✓ Successfully fetched data for: /g/1211cg58 (SI)
2026-01-05 04:16:57,747 - INFO - Waiting 4.0s before next request...
2026-01-05 04:17:01,756 - INFO - [3/5] SI - Processing: /m/012_3l
2026-01-05 04:17:03,262 - INFO - ✓ Successfully fetched data for: /m/012_3l (SI)
2026-01-05 04:17:03,263 - INFO - Waiting 3.2s before next request...
2026-01-05 04:17:06,418 - INFO - [4/5] SI - Processing: /m/0gfps3
2026-01-05 04:17:07,940 - INFO - ✓ Successfully fetched data for: /m/0gfps3 (SI)
2026-01-05 04:17:07,940 - INFO - Waiting 3.5s before next request...
2026-01-05 04:17:11,468 - INFO - [5/5] SI - Processing: /g/11gbfbpzht
2026-01-05 04:17:11,828 - INFO - ✓ Successfully fetched data for: /g/11gbfbpzht (SI)
2026-01-05 04:17:11,838 - INFO - Saved master file for SI with 166 rows and 44 terms
2026-01-05 04:17:11,838 - INFO - 💾 Updated master file for SI with 5 new terms
2026-01-05 04:17:11,839 - INFO - 💾 Created backup: data/trends_results/trends_backup_SI_20260105_041711.csv
2026-01-05 04:17:11,840 - INFO - Waiting 6.0s before next country...
2026-01-05 04:17:17,851 - INFO - ============================================================
2026-01-05 04:17:17,852 - INFO - Processing country: ES (ES)
2026-01-05 04:17:17,852 - INFO - ============================================================
2026-01-05 04:17:17,854 - INFO - Loaded master file for ES with 166 rows and 39 terms
2026-01-05 04:17:17,854 - INFO - Processing batch of 5 terms for ES
2026-01-05 04:17:17,854 - INFO - Remaining terms after this batch: 0
2026-01-05 04:17:17,855 - INFO - [1/5] ES - Processing: /m/01q82
2026-01-05 04:17:18,271 - INFO - ✓ Successfully fetched data for: /m/01q82 (ES)
2026-01-05 04:17:18,271 - INFO - Waiting 4.2s before next request...
2026-01-05 04:17:22,461 - INFO - [2/5] ES - Processing: /g/1211cg58
2026-01-05 04:17:23,189 - INFO - ✓ Successfully fetched data for: /g/1211cg58 (ES)
2026-01-05 04:17:23,189 - INFO - Waiting 5.0s before next request...
2026-01-05 04:17:28,154 - INFO - [3/5] ES - Processing: /m/012_3l
2026-01-05 04:17:28,722 - INFO - ✓ Successfully fetched data for: /m/012_3l (ES)
2026-01-05 04:17:28,723 - INFO - Waiting 4.2s before next request...
2026-01-05 04:17:32,956 - INFO - [4/5] ES - Processing: /m/0gfps3
2026-01-05 04:17:33,604 - INFO - ✓ Successfully fetched data for: /m/0gfps3 (ES)
2026-01-05 04:17:33,604 - INFO - Waiting 5.4s before next request...
2026-01-05 04:17:38,993 - INFO - [5/5] ES - Processing: /g/11gbfbpzht
2026-01-05 04:17:39,674 - INFO - ✓ Successfully fetched data for: /g/11gbfbpzht (ES)
2026-01-05 04:17:39,683 - INFO - Saved master file for ES with 166 rows and 44 terms
2026-01-05 04:17:39,683 - INFO - 💾 Updated master file for ES with 5 new terms
2026-01-05 04:17:39,685 - INFO - 💾 Created backup: data/trends_results/trends_backup_ES_20260105_041739.csv
2026-01-05 04:17:39,685 - INFO - Waiting 9.5s before next country...
2026-01-05 04:17:49,206 - INFO - ============================================================
2026-01-05 04:17:49,206 - INFO - Processing country: TR (TR)
2026-01-05 04:17:49,206 - INFO - ============================================================
2026-01-05 04:17:49,209 - INFO - Loaded master file for TR with 166 rows and 39 terms
2026-01-05 04:17:49,209 - INFO - Processing batch of 5 terms for TR
2026-01-05 04:17:49,209 - INFO - Remaining terms after this batch: 0
2026-01-05 04:17:49,209 - INFO - [1/5] TR - Processing: /m/01q82
2026-01-05 04:17:49,728 - INFO - ✓ Successfully fetched data for: /m/01q82 (TR)
2026-01-05 04:17:49,728 - INFO - Waiting 4.0s before next request...
2026-01-05 04:17:53,718 - INFO - [2/5] TR - Processing: /g/1211cg58
2026-01-05 04:17:54,202 - INFO - ✓ Successfully fetched data for: /g/1211cg58 (TR)
2026-01-05 04:17:54,202 - INFO - Waiting 5.1s before next request...
2026-01-05 04:17:59,332 - INFO - [3/5] TR - Processing: /m/012_3l
2026-01-05 04:17:59,857 - INFO - ✓ Successfully fetched data for: /m/012_3l (TR)
2026-01-05 04:17:59,857 - INFO - Waiting 5.7s before next request...
2026-01-05 04:18:05,561 - INFO - [4/5] TR - Processing: /m/0gfps3
2026-01-05 04:18:06,109 - INFO - ✓ Successfully fetched data for: /m/0gfps3 (TR)
2026-01-05 04:18:06,110 - INFO - Waiting 4.8s before next request...
2026-01-05 04:18:10,958 - INFO - [5/5] TR - Processing: /g/11gbfbpzht
2026-01-05 04:18:11,526 - INFO - ✓ Successfully fetched data for: /g/11gbfbpzht (TR)
2026-01-05 04:18:11,535 - INFO - Saved master file for TR with 166 rows and 44 terms
2026-01-05 04:18:11,535 - INFO - 💾 Updated master file for TR with 5 new terms
2026-01-05 04:18:11,537 - INFO - 💾 Created backup: data/trends_results/trends_backup_TR_20260105_041811.csv
2026-01-05 04:18:11,537 - INFO - Waiting 9.8s before next country...
2026-01-05 04:18:21,299 - INFO - ============================================================
2026-01-05 04:18:21,299 - INFO - Processing country: GB (GB)
2026-01-05 04:18:21,299 - INFO - ============================================================
2026-01-05 04:18:21,302 - INFO - Loaded master file for GB with 166 rows and 39 terms
2026-01-05 04:18:21,302 - INFO - Processing batch of 5 terms for GB
2026-01-05 04:18:21,302 - INFO - Remaining terms after this batch: 0
2026-01-05 04:18:21,302 - INFO - [1/5] GB - Processing: /m/01q82
2026-01-05 04:18:21,688 - INFO - ✓ Successfully fetched data for: /m/01q82 (GB)
2026-01-05 04:18:21,688 - INFO - Waiting 4.7s before next request...
2026-01-05 04:18:26,442 - INFO - [2/5] GB - Processing: /g/1211cg58
2026-01-05 04:18:26,758 - INFO - ✓ Successfully fetched data for: /g/1211cg58 (GB)
2026-01-05 04:18:26,759 - INFO - Waiting 3.7s before next request...
2026-01-05 04:18:30,497 - INFO - [3/5] GB - Processing: /m/012_3l
2026-01-05 04:18:30,938 - INFO - ✓ Successfully fetched data for: /m/012_3l (GB)
2026-01-05 04:18:30,938 - INFO - Waiting 5.6s before next request...
2026-01-05 04:18:36,560 - INFO - [4/5] GB - Processing: /m/0gfps3
2026-01-05 04:18:37,092 - INFO - ✓ Successfully fetched data for: /m/0gfps3 (GB)
2026-01-05 04:18:37,092 - INFO - Waiting 4.8s before next request...
2026-01-05 04:18:41,946 - INFO - [5/5] GB - Processing: /g/11gbfbpzht
2026-01-05 04:18:42,592 - INFO - ✓ Successfully fetched data for: /g/11gbfbpzht (GB)
2026-01-05 04:18:42,601 - INFO - Saved master file for GB with 166 rows and 44 terms
2026-01-05 04:18:42,601 - INFO - 💾 Updated master file for GB with 5 new terms
2026-01-05 04:18:42,603 - INFO - 💾 Created backup: data/trends_results/trends_backup_GB_20260105_041842.csv
2026-01-05 04:18:42,603 - INFO - Waiting 9.7s before next country...
2026-01-05 04:18:52,295 - INFO - ============================================================
2026-01-05 04:18:52,295 - INFO - Processing country: RU (RU)
2026-01-05 04:18:52,295 - INFO - ============================================================
2026-01-05 04:18:52,298 - INFO - Loaded master file for RU with 166 rows and 39 terms
2026-01-05 04:18:52,298 - INFO - Processing batch of 5 terms for RU
2026-01-05 04:18:52,298 - INFO - Remaining terms after this batch: 0
2026-01-05 04:18:52,298 - INFO - [1/5] RU - Processing: /m/01q82
2026-01-05 04:18:52,723 - INFO - ✓ Successfully fetched data for: /m/01q82 (RU)
2026-01-05 04:18:52,723 - INFO - Waiting 3.7s before next request...
2026-01-05 04:18:56,381 - INFO - [2/5] RU - Processing: /g/1211cg58
2026-01-05 04:18:56,712 - INFO - ✓ Successfully fetched data for: /g/1211cg58 (RU)
2026-01-05 04:18:56,712 - INFO - Waiting 3.3s before next request...
2026-01-05 04:19:00,037 - INFO - [3/5] RU - Processing: /m/012_3l
2026-01-05 04:19:00,423 - INFO - ✓ Successfully fetched data for: /m/012_3l (RU)
2026-01-05 04:19:00,423 - INFO - Waiting 5.5s before next request...
2026-01-05 04:19:05,929 - INFO - [4/5] RU - Processing: /m/0gfps3
2026-01-05 04:19:06,468 - INFO - ✓ Successfully fetched data for: /m/0gfps3 (RU)
2026-01-05 04:19:06,468 - INFO - Waiting 5.5s before next request...
2026-01-05 04:19:11,962 - INFO - [5/5] RU - Processing: /g/11gbfbpzht
2026-01-05 04:19:12,384 - INFO - ✓ Successfully fetched data for: /g/11gbfbpzht (RU)
2026-01-05 04:19:12,394 - INFO - Saved master file for RU with 166 rows and 44 terms
2026-01-05 04:19:12,395 - INFO - 💾 Updated master file for RU with 5 new terms
2026-01-05 04:19:12,396 - INFO - 💾 Created backup: data/trends_results/trends_backup_RU_20260105_041912.csv
2026-01-05 04:19:12,396 - INFO - Waiting 10.2s before next country...
2026-01-05 04:19:22,650 - INFO - ============================================================
2026-01-05 04:19:22,650 - INFO - Processing country: ID (ID)
2026-01-05 04:19:22,650 - INFO - ============================================================
2026-01-05 04:19:22,653 - INFO - Loaded master file for ID with 166 rows and 39 terms
2026-01-05 04:19:22,653 - INFO - Processing batch of 5 terms for ID
2026-01-05 04:19:22,653 - INFO - Remaining terms after this batch: 0
2026-01-05 04:19:22,653 - INFO - [1/5] ID - Processing: /m/01q82
2026-01-05 04:19:23,056 - INFO - ✓ Successfully fetched data for: /m/01q82 (ID)
2026-01-05 04:19:23,056 - INFO - Waiting 5.0s before next request...
2026-01-05 04:19:28,088 - INFO - [2/5] ID - Processing: /g/1211cg58
2026-01-05 04:19:28,442 - INFO - ✓ Successfully fetched data for: /g/1211cg58 (ID)
2026-01-05 04:19:28,442 - INFO - Waiting 5.3s before next request...
2026-01-05 04:19:33,723 - INFO - [3/5] ID - Processing: /m/012_3l
2026-01-05 04:19:34,162 - INFO - ✓ Successfully fetched data for: /m/012_3l (ID)
2026-01-05 04:19:34,162 - INFO - Waiting 3.7s before next request...
2026-01-05 04:19:37,852 - INFO - [4/5] ID - Processing: /m/0gfps3
2026-01-05 04:19:38,393 - INFO - ✓ Successfully fetched data for: /m/0gfps3 (ID)
2026-01-05 04:19:38,393 - INFO - Waiting 5.5s before next request...
2026-01-05 04:19:43,915 - INFO - [5/5] ID - Processing: /g/11gbfbpzht
2026-01-05 04:19:45,082 - INFO - ✓ Successfully fetched data for: /g/11gbfbpzht (ID)
2026-01-05 04:19:45,092 - INFO - Saved master file for ID with 166 rows and 44 terms
2026-01-05 04:19:45,092 - INFO - 💾 Updated master file for ID with 5 new terms
2026-01-05 04:19:45,094 - INFO - 💾 Created backup: data/trends_results/trends_backup_ID_20260105_041945.csv
2026-01-05 04:19:45,094 - INFO - Waiting 10.3s before next country...
2026-01-05 04:19:55,370 - INFO - ============================================================
2026-01-05 04:19:55,370 - INFO - Processing country: SE (SE)
2026-01-05 04:19:55,370 - INFO - ============================================================
2026-01-05 04:19:55,373 - INFO - Loaded master file for SE with 166 rows and 39 terms
2026-01-05 04:19:55,373 - INFO - Processing batch of 5 terms for SE
2026-01-05 04:19:55,373 - INFO - Remaining terms after this batch: 0
2026-01-05 04:19:55,373 - INFO - [1/5] SE - Processing: /m/01q82
2026-01-05 04:19:55,721 - INFO - ✓ Successfully fetched data for: /m/01q82 (SE)
2026-01-05 04:19:55,721 - INFO - Waiting 3.2s before next request...
2026-01-05 04:19:58,972 - INFO - [2/5] SE - Processing: /g/1211cg58
2026-01-05 04:19:59,328 - INFO - ✓ Successfully fetched data for: /g/1211cg58 (SE)
2026-01-05 04:19:59,329 - INFO - Waiting 4.5s before next request...
2026-01-05 04:20:03,844 - INFO - [3/5] SE - Processing: /m/012_3l
2026-01-05 04:20:04,210 - INFO - ✓ Successfully fetched data for: /m/012_3l (SE)
2026-01-05 04:20:04,210 - INFO - Waiting 5.8s before next request...
2026-01-05 04:20:10,066 - INFO - [4/5] SE - Processing: /m/0gfps3
2026-01-05 04:20:10,554 - INFO - ✓ Successfully fetched data for: /m/0gfps3 (SE)
2026-01-05 04:20:10,554 - INFO - Waiting 4.3s before next request...
2026-01-05 04:20:14,893 - INFO - [5/5] SE - Processing: /g/11gbfbpzht
2026-01-05 04:20:15,332 - INFO - ✓ Successfully fetched data for: /g/11gbfbpzht (SE)
2026-01-05 04:20:15,342 - INFO - Saved master file for SE with 166 rows and 44 terms
2026-01-05 04:20:15,342 - INFO - 💾 Updated master file for SE with 5 new terms
2026-01-05 04:20:15,344 - INFO - 💾 Created backup: data/trends_results/trends_backup_SE_20260105_042015.csv
2026-01-05 04:20:15,344 - INFO - Waiting 8.2s before next country...
2026-01-05 04:20:23,525 - INFO - ============================================================
2026-01-05 04:20:23,525 - INFO - Processing country: BR (BR)
2026-01-05 04:20:23,525 - INFO - ============================================================
2026-01-05 04:20:23,528 - INFO - Loaded master file for BR with 166 rows and 39 terms
2026-01-05 04:20:23,528 - INFO - Processing batch of 5 terms for BR
2026-01-05 04:20:23,528 - INFO - Remaining terms after this batch: 0
2026-01-05 04:20:23,528 - INFO - [1/5] BR - Processing: /m/01q82
2026-01-05 04:20:24,318 - INFO - ✓ Successfully fetched data for: /m/01q82 (BR)
2026-01-05 04:20:24,318 - INFO - Waiting 5.3s before next request...
2026-01-05 04:20:29,584 - INFO - [2/5] BR - Processing: /g/1211cg58
2026-01-05 04:20:30,270 - INFO - ✓ Successfully fetched data for: /g/1211cg58 (BR)
2026-01-05 04:20:30,270 - INFO - Waiting 5.1s before next request...
2026-01-05 04:20:35,419 - INFO - [3/5] BR - Processing: /m/012_3l
2026-01-05 04:20:35,841 - INFO - ✓ Successfully fetched data for: /m/012_3l (BR)
2026-01-05 04:20:35,841 - INFO - Waiting 3.3s before next request...
2026-01-05 04:20:39,164 - INFO - [4/5] BR - Processing: /m/0gfps3
2026-01-05 04:20:41,274 - INFO - ✓ Successfully fetched data for: /m/0gfps3 (BR)
2026-01-05 04:20:41,274 - INFO - Waiting 5.0s before next request...
2026-01-05 04:20:46,306 - INFO - [5/5] BR - Processing: /g/11gbfbpzht
2026-01-05 04:20:48,090 - INFO - ✓ Successfully fetched data for: /g/11gbfbpzht (BR)
2026-01-05 04:20:48,100 - INFO - Saved master file for BR with 166 rows and 44 terms
2026-01-05 04:20:48,100 - INFO - 💾 Updated master file for BR with 5 new terms
2026-01-05 04:20:48,102 - INFO - 💾 Created backup: data/trends_results/trends_backup_BR_20260105_042048.csv
2026-01-05 04:20:48,102 - INFO - Waiting 11.7s before next country...
2026-01-05 04:20:59,777 - INFO - ============================================================
2026-01-05 04:20:59,777 - INFO - Processing country: CN (CN)
2026-01-05 04:20:59,778 - INFO - ============================================================
2026-01-05 04:20:59,780 - INFO - Loaded master file for CN with 166 rows and 39 terms
2026-01-05 04:20:59,780 - INFO - Processing batch of 5 terms for CN
2026-01-05 04:20:59,780 - INFO - Remaining terms after this batch: 0
2026-01-05 04:20:59,780 - INFO - [1/5] CN - Processing: /m/01q82
2026-01-05 04:21:00,135 - INFO - ✓ Successfully fetched data for: /m/01q82 (CN)
2026-01-05 04:21:00,135 - INFO - Waiting 5.8s before next request...
2026-01-05 04:21:05,934 - INFO - [2/5] CN - Processing: /g/1211cg58
2026-01-05 04:21:06,289 - INFO - ✓ Successfully fetched data for: /g/1211cg58 (CN)
2026-01-05 04:21:06,289 - INFO - Waiting 3.1s before next request...
2026-01-05 04:21:09,351 - INFO - [3/5] CN - Processing: /m/012_3l
2026-01-05 04:21:09,741 - INFO - ✓ Successfully fetched data for: /m/012_3l (CN)
2026-01-05 04:21:09,741 - INFO - Waiting 4.2s before next request...
2026-01-05 04:21:13,982 - INFO - [4/5] CN - Processing: /m/0gfps3
2026-01-05 04:21:14,415 - INFO - ✓ Successfully fetched data for: /m/0gfps3 (CN)
2026-01-05 04:21:14,415 - INFO - Waiting 4.7s before next request...
2026-01-05 04:21:19,141 - INFO - [5/5] CN - Processing: /g/11gbfbpzht
2026-01-05 04:21:19,520 - INFO - ✓ Successfully fetched data for: /g/11gbfbpzht (CN)
2026-01-05 04:21:19,530 - INFO - Saved master file for CN with 166 rows and 44 terms
2026-01-05 04:21:19,530 - INFO - 💾 Updated master file for CN with 5 new terms
2026-01-05 04:21:19,532 - INFO - 💾 Created backup: data/trends_results/trends_backup_CN_20260105_042119.csv
2026-01-05 04:21:19,532 - INFO - Waiting 7.8s before next country...
2026-01-05 04:21:27,366 - INFO - ============================================================
2026-01-05 04:21:27,366 - INFO - Processing country: US (US)
2026-01-05 04:21:27,366 - INFO - ============================================================
2026-01-05 04:21:27,369 - INFO - Loaded master file for US with 166 rows and 39 terms
2026-01-05 04:21:27,369 - INFO - Processing batch of 5 terms for US
2026-01-05 04:21:27,369 - INFO - Remaining terms after this batch: 0
2026-01-05 04:21:27,369 - INFO - [1/5] US - Processing: /m/01q82
2026-01-05 04:21:27,826 - INFO - ✓ Successfully fetched data for: /m/01q82 (US)
2026-01-05 04:21:27,826 - INFO - Waiting 5.0s before next request...
2026-01-05 04:21:32,846 - INFO - [2/5] US - Processing: /g/1211cg58
2026-01-05 04:21:33,707 - INFO - ✓ Successfully fetched data for: /g/1211cg58 (US)
2026-01-05 04:21:33,707 - INFO - Waiting 5.7s before next request...
2026-01-05 04:21:39,440 - INFO - [3/5] US - Processing: /m/012_3l
2026-01-05 04:21:39,987 - INFO - ✓ Successfully fetched data for: /m/012_3l (US)
2026-01-05 04:21:39,987 - INFO - Waiting 3.2s before next request...
2026-01-05 04:21:43,232 - INFO - [4/5] US - Processing: /m/0gfps3
2026-01-05 04:21:43,908 - INFO - ✓ Successfully fetched data for: /m/0gfps3 (US)
2026-01-05 04:21:43,909 - INFO - Waiting 5.7s before next request...
2026-01-05 04:21:49,612 - INFO - [5/5] US - Processing: /g/11gbfbpzht
2026-01-05 04:21:50,443 - INFO - ✓ Successfully fetched data for: /g/11gbfbpzht (US)
2026-01-05 04:21:50,453 - INFO - Saved master file for US with 166 rows and 44 terms
2026-01-05 04:21:50,453 - INFO - 💾 Updated master file for US with 5 new terms
2026-01-05 04:21:50,455 - INFO - 💾 Created backup: data/trends_results/trends_backup_US_20260105_042150.csv
2026-01-05 04:21:50,455 - INFO - Waiting 8.7s before next country...
2026-01-05 04:21:59,189 - INFO - ============================================================
2026-01-05 04:21:59,189 - INFO - Processing country: ZA (ZA)
2026-01-05 04:21:59,189 - INFO - ============================================================
2026-01-05 04:21:59,192 - INFO - Loaded master file for ZA with 166 rows and 39 terms
2026-01-05 04:21:59,192 - INFO - Processing batch of 5 terms for ZA
2026-01-05 04:21:59,192 - INFO - Remaining terms after this batch: 0
2026-01-05 04:21:59,192 - INFO - [1/5] ZA - Processing: /m/01q82
2026-01-05 04:21:59,564 - INFO - ✓ Successfully fetched data for: /m/01q82 (ZA)
2026-01-05 04:21:59,564 - INFO - Waiting 4.2s before next request...
2026-01-05 04:22:03,787 - INFO - [2/5] ZA - Processing: /g/1211cg58
2026-01-05 04:22:04,144 - INFO - ✓ Successfully fetched data for: /g/1211cg58 (ZA)
2026-01-05 04:22:04,144 - INFO - Waiting 4.6s before next request...
2026-01-05 04:22:08,701 - INFO - [3/5] ZA - Processing: /m/012_3l
2026-01-05 04:22:09,067 - INFO - ✓ Successfully fetched data for: /m/012_3l (ZA)
2026-01-05 04:22:09,067 - INFO - Waiting 5.8s before next request...
2026-01-05 04:22:14,875 - INFO - [4/5] ZA - Processing: /m/0gfps3
2026-01-05 04:22:15,358 - INFO - ✓ Successfully fetched data for: /m/0gfps3 (ZA)
2026-01-05 04:22:15,358 - INFO - Waiting 4.7s before next request...
2026-01-05 04:22:20,101 - INFO - [5/5] ZA - Processing: /g/11gbfbpzht
2026-01-05 04:22:20,560 - INFO - ✓ Successfully fetched data for: /g/11gbfbpzht (ZA)
2026-01-05 04:22:20,570 - INFO - Saved master file for ZA with 166 rows and 44 terms
2026-01-05 04:22:20,570 - INFO - 💾 Updated master file for ZA with 5 new terms
2026-01-05 04:22:20,572 - INFO - 💾 Created backup: data/trends_results/trends_backup_ZA_20260105_042220.csv
2026-01-05 04:22:20,572 - INFO - Waiting 9.2s before next country...
2026-01-05 04:22:29,732 - INFO - ============================================================
2026-01-05 04:22:29,732 - INFO - Processing country: CH (CH)
2026-01-05 04:22:29,732 - INFO - ============================================================
2026-01-05 04:22:29,735 - INFO - Loaded master file for CH with 166 rows and 39 terms
2026-01-05 04:22:29,735 - INFO - Processing batch of 5 terms for CH
2026-01-05 04:22:29,735 - INFO - Remaining terms after this batch: 0
2026-01-05 04:22:29,735 - INFO - [1/5] CH - Processing: /m/01q82
2026-01-05 04:22:30,109 - INFO - ✓ Successfully fetched data for: /m/01q82 (CH)
2026-01-05 04:22:30,109 - INFO - Waiting 5.1s before next request...
2026-01-05 04:22:35,200 - INFO - [2/5] CH - Processing: /g/1211cg58
2026-01-05 04:22:35,544 - INFO - ✓ Successfully fetched data for: /g/1211cg58 (CH)
2026-01-05 04:22:35,544 - INFO - Waiting 3.1s before next request...
2026-01-05 04:22:38,606 - INFO - [3/5] CH - Processing: /m/012_3l
2026-01-05 04:22:38,973 - INFO - ✓ Successfully fetched data for: /m/012_3l (CH)
2026-01-05 04:22:38,973 - INFO - Waiting 4.5s before next request...
2026-01-05 04:22:43,482 - INFO - [4/5] CH - Processing: /m/0gfps3
2026-01-05 04:22:43,921 - INFO - ✓ Successfully fetched data for: /m/0gfps3 (CH)
2026-01-05 04:22:43,921 - INFO - Waiting 3.6s before next request...
2026-01-05 04:22:47,552 - INFO - [5/5] CH - Processing: /g/11gbfbpzht
2026-01-05 04:22:48,055 - INFO - ✓ Successfully fetched data for: /g/11gbfbpzht (CH)
2026-01-05 04:22:48,065 - INFO - Saved master file for CH with 166 rows and 44 terms
2026-01-05 04:22:48,065 - INFO - 💾 Updated master file for CH with 5 new terms
2026-01-05 04:22:48,067 - INFO - 💾 Created backup: data/trends_results/trends_backup_CH_20260105_042248.csv
2026-01-05 04:22:48,067 - INFO - Waiting 7.4s before next country...
2026-01-05 04:22:55,427 - INFO - ============================================================
2026-01-05 04:22:55,427 - INFO - Processing country: IN (IN)
2026-01-05 04:22:55,427 - INFO - ============================================================
2026-01-05 04:22:55,430 - INFO - Loaded master file for IN with 166 rows and 39 terms
2026-01-05 04:22:55,430 - INFO - Processing batch of 5 terms for IN
2026-01-05 04:22:55,430 - INFO - Remaining terms after this batch: 0
2026-01-05 04:22:55,430 - INFO - [1/5] IN - Processing: /m/01q82
2026-01-05 04:22:55,895 - INFO - ✓ Successfully fetched data for: /m/01q82 (IN)
2026-01-05 04:22:55,895 - INFO - Waiting 4.3s before next request...
2026-01-05 04:23:00,201 - INFO - [2/5] IN - Processing: /g/1211cg58
2026-01-05 04:23:00,900 - INFO - ✓ Successfully fetched data for: /g/1211cg58 (IN)
2026-01-05 04:23:00,901 - INFO - Waiting 4.2s before next request...
2026-01-05 04:23:05,099 - INFO - [3/5] IN - Processing: /m/012_3l
2026-01-05 04:23:05,932 - INFO - ✓ Successfully fetched data for: /m/012_3l (IN)
2026-01-05 04:23:05,933 - INFO - Waiting 4.6s before next request...
2026-01-05 04:23:10,531 - INFO - [4/5] IN - Processing: /m/0gfps3
2026-01-05 04:23:11,881 - INFO - ✓ Successfully fetched data for: /m/0gfps3 (IN)
2026-01-05 04:23:11,881 - INFO - Waiting 4.4s before next request...
2026-01-05 04:23:16,290 - INFO - [5/5] IN - Processing: /g/11gbfbpzht
2026-01-05 04:23:17,682 - INFO - ✓ Successfully fetched data for: /g/11gbfbpzht (IN)
2026-01-05 04:23:17,692 - INFO - Saved master file for IN with 166 rows and 44 terms
2026-01-05 04:23:17,692 - INFO - 💾 Updated master file for IN with 5 new terms
2026-01-05 04:23:17,694 - INFO - 💾 Created backup: data/trends_results/trends_backup_IN_20260105_042317.csv
2026-01-05 04:23:17,694 - INFO - ============================================================
2026-01-05 04:23:17,694 - INFO - Overall Job Summary
2026-01-05 04:23:17,694 - INFO - ✓ Total successful: 205
2026-01-05 04:23:17,694 - INFO - ✗ Total failed: 0
2026-01-05 04:23:17,694 - INFO - 📊 Countries processed: 41
2026-01-05 04:23:17,694 - INFO - 📊 Total terms: 5
2026-01-05 04:23:17,694 - INFO -   DK (DK): 5/5 complete, 0 remaining
2026-01-05 04:23:17,694 - INFO -   AU (AU): 5/5 complete, 0 remaining
2026-01-05 04:23:17,694 - INFO -   CL (CL): 5/5 complete, 0 remaining
2026-01-05 04:23:17,694 - INFO -   CO (CO): 5/5 complete, 0 remaining
2026-01-05 04:23:17,694 - INFO -   EE (EE): 5/5 complete, 0 remaining
2026-01-05 04:23:17,694 - INFO -   FI (FI): 5/5 complete, 0 remaining
2026-01-05 04:23:17,694 - INFO -   FR (FR): 5/5 complete, 0 remaining
2026-01-05 04:23:17,694 - INFO -   DE (DE): 5/5 complete, 0 remaining
2026-01-05 04:23:17,694 - INFO -   KR (KR): 5/5 complete, 0 remaining
2026-01-05 04:23:17,694 - INFO -   LT (LT): 5/5 complete, 0 remaining
2026-01-05 04:23:17,694 - INFO -   NL (NL): 5/5 complete, 0 remaining
2026-01-05 04:23:17,694 - INFO -   SK (SK): 5/5 complete, 0 remaining
2026-01-05 04:23:17,694 - INFO -   HU (HU): 5/5 complete, 0 remaining
2026-01-05 04:23:17,694 - INFO -   LV (LV): 5/5 complete, 0 remaining
2026-01-05 04:23:17,695 - INFO -   PL (PL): 5/5 complete, 0 remaining
2026-01-05 04:23:17,695 - INFO -   PT (PT): 5/5 complete, 0 remaining
2026-01-05 04:23:17,695 - INFO -   IL (IL): 5/5 complete, 0 remaining
2026-01-05 04:23:17,695 - INFO -   IT (IT): 5/5 complete, 0 remaining
2026-01-05 04:23:17,695 - INFO -   CR (CR): 5/5 complete, 0 remaining
2026-01-05 04:23:17,695 - INFO -   BE (BE): 5/5 complete, 0 remaining
2026-01-05 04:23:17,695 - INFO -   CZ (CZ): 5/5 complete, 0 remaining
2026-01-05 04:23:17,695 - INFO -   GR (GR): 5/5 complete, 0 remaining
2026-01-05 04:23:17,695 - INFO -   NZ (NZ): 5/5 complete, 0 remaining
2026-01-05 04:23:17,695 - INFO -   MX (MX): 5/5 complete, 0 remaining
2026-01-05 04:23:17,695 - INFO -   LU (LU): 5/5 complete, 0 remaining
2026-01-05 04:23:17,695 - INFO -   AT (AT): 5/5 complete, 0 remaining
2026-01-05 04:23:17,695 - INFO -   JP (JP): 5/5 complete, 0 remaining
2026-01-05 04:23:17,695 - INFO -   IE (IE): 5/5 complete, 0 remaining
2026-01-05 04:23:17,695 - INFO -   SI (SI): 5/5 complete, 0 remaining
2026-01-05 04:23:17,695 - INFO -   ES (ES): 5/5 complete, 0 remaining
2026-01-05 04:23:17,695 - INFO -   TR (TR): 5/5 complete, 0 remaining
2026-01-05 04:23:17,695 - INFO -   GB (GB): 5/5 complete, 0 remaining
2026-01-05 04:23:17,695 - INFO -   RU (RU): 5/5 complete, 0 remaining
2026-01-05 04:23:17,695 - INFO -   ID (ID): 5/5 complete, 0 remaining
2026-01-05 04:23:17,695 - INFO -   SE (SE): 5/5 complete, 0 remaining
2026-01-05 04:23:17,695 - INFO -   BR (BR): 5/5 complete, 0 remaining
2026-01-05 04:23:17,695 - INFO -   CN (CN): 5/5 complete, 0 remaining
2026-01-05 04:23:17,695 - INFO -   US (US): 5/5 complete, 0 remaining
2026-01-05 04:23:17,695 - INFO -   ZA (ZA): 5/5 complete, 0 remaining
2026-01-05 04:23:17,695 - INFO -   CH (CH): 5/5 complete, 0 remaining
2026-01-05 04:23:17,695 - INFO -   IN (IN): 5/5 complete, 0 remaining
2026-01-05 04:23:17,695 - INFO - 🎉 All terms downloaded for all countries!
2026-01-05 04:23:17,695 - INFO - ============================================================
